Track_Artists,duration_ms,id,Track_Name,Album_ID,total_tracks,Album_Name,release_date,Album_Artists,Producer,Producer_ID,_merge,Lyrics
"[{'external_urls': {'spotify': 'https://open.spotify.com/artist/4YRxDV8wJFPHPTeXepOstw'}, 'href': 'https://api.spotify.com/v1/artists/4YRxDV8wJFPHPTeXepOstw', 'id': '4YRxDV8wJFPHPTeXepOstw', 'name': 'Arijit Singh', 'type': 'artist', 'uri': 'spotify:artist:4YRxDV8wJFPHPTeXepOstw'}]",274000,3trnNo4KeaUlFuUiV7iRCj,Tera Chehra,2yYfIOq25JQWvUQ9AR172D,9,Sanam Teri Kasam ,2016-01-06,"[{'external_urls': {'spotify': 'https://open.spotify.com/artist/0sSxphmGskGCKlwB9xa6WU'}, 'href': 'https://api.spotify.com/v1/artists/0sSxphmGskGCKlwB9xa6WU', 'id': '0sSxphmGskGCKlwB9xa6WU', 'name': 'Himesh Reshammiya', 'type': 'artist', 'uri': 'spotify:artist:0sSxphmGskGCKlwB9xa6WU'}]",Himesh Reshammiya,0sSxphmGskGCKlwB9xa6WU,both,"Chehra Tera Chand Jeha
Oh Baaki Sab Taare Ni
Vaade Tere Reh Na Jaan
Haye Ban Ban Laare Ni
Oh Gora Gora Rang Chakki
Phirdi Ae
Ho Mere Piche Payi Kine
Chirdi Ae
Oh Gora Gora Rang Chakki
Phirdi Ae
Ho Mere Piche Payi Kine
Chirdi Ae

Kehan Mainu Pichha Aida
Chad De Tu Saare Ni
Chehra Tera Chand Jeha
Oh Baki Sab Tare Ni
Vaade Tere Reh Na Jaan
Haye Ban Ban Laare Ni

Heeriye Kade Door Na Hove
Dil Mera
Kade Choor Na Howe
Heeriye Kade Door Na Hove
Dil Mera, Dil Mera
Heeriye Kade Door Na Hove
Dil Mera
Kade Chur Na Hove
You Might Also Likebilli Teri Ankh Sannu
Har Roj Maare Ni
Chehara Tera Chand Jeha
Oh Baaki Sab Taare Ni
Vaade Tere Reh Na Jaan
Haye Ban Ban Laare Ni

Manaka Tere Naal Savera
Manaka Tere Naal Hai Nera
Manaka Teray Nal Savera
Manaka
Ho Manaka Tere Nal Sawera
Manaka Tere Nal Hai Nera

Jitte Gayi Tu Sohniye Ni
Haye Assi Teh To Haare Ni
Chehara Tera Chand Jeha
Oh Baki Sab Tare Ni
Vaade Tere Reh Na Jaan
Haye Ban Ban Laare Ni
Chehara Tera Chand Jeha
Oh Baki Sab Tare Ni
Vaade Tere Reh Na Jaan
Haye Ban Ban Laare Ni

Sharry Nexus!Embed"
"[{'external_urls': {'spotify': 'https://open.spotify.com/artist/4YRxDV8wJFPHPTeXepOstw'}, 'href': 'https://api.spotify.com/v1/artists/4YRxDV8wJFPHPTeXepOstw', 'id': '4YRxDV8wJFPHPTeXepOstw', 'name': 'Arijit Singh', 'type': 'artist', 'uri': 'spotify:artist:4YRxDV8wJFPHPTeXepOstw'}]",256000,4HCh7uiSv1cwmtkoahFP8k,Main Teri Yaadon Mein,2yYfIOq25JQWvUQ9AR172D,9,Sanam Teri Kasam ,2016-01-06,"[{'external_urls': {'spotify': 'https://open.spotify.com/artist/0sSxphmGskGCKlwB9xa6WU'}, 'href': 'https://api.spotify.com/v1/artists/0sSxphmGskGCKlwB9xa6WU', 'id': '0sSxphmGskGCKlwB9xa6WU', 'name': 'Himesh Reshammiya', 'type': 'artist', 'uri': 'spotify:artist:0sSxphmGskGCKlwB9xa6WU'}]",Himesh Reshammiya,0sSxphmGskGCKlwB9xa6WU,both,"[Verse 1]
Wo Dekh Phir Se Unki Tujhpe Nazren Hain
Kab Se Teri Awaaz Ke Liye Taras Rahe Hain
Per Kuch Naraz Hain, Tujhse Pakre Hain
Teri Janamaaz Dekh Kar Tujhpe Tapre Hain
Islam Aur Allah Tera Bakwaas Hai
Jawab Iska Jis Mulk Mein Tera Naam Hai
Hawaai Adam Ka Mazhab Islam Yeh
Rakhi Saawant Se Bhi Ziada Badnaam Hai

Yeh Kurta Shalwaar Tu Bahar Kyun Ni Pehenta?
Mosiqi Haram Hai Ispe Tera Kya Kehna?
Bhae Kholde Zanjeeren, Kuch Tou Rehem Kha
Main Dost Hun Tera .. Ilaaj Kara Zehen Ka
Mu Kyun Band Hai Tera Kuch Tou Bhaunk Na!!
Yeh Loag Bolrahe Hain Tu Munaafiq Firawn Sa!
Lautja Gunaahon Mein Lautja, Kuch Nahi Karskta Tu Is Gandi Qaum Ka

Jin Mulkon Mein Mashoor Tu, Wahan Dekhega Nangi Hoor Tu
Jin Mulkon Mеin De Shaoor Tu, Wahan Dekhega Maghribi Dastoor Tu
Khaal Mеin Siyaahi, Safaid Baal Wah..
Tu Khud Bhi Ghulam Maghribi Riwaaj Ka
Industry Ka Dushman Tu Dushman Dajjal Ka
Per Ulma Ka Fatwa Tu Kaafir Samaaj Ka

Huh Gandi ... Teri Bhi Tou Ek Bandi
Tujhe Bhi Tou Lagti Hai Bhook Badan Ki
Badan Ki Bhook Tou Zarurat Ek Mard Ki
Phir Tune Yeh Kesi Rakhdi Paabandi???
(Adhaan Sound) Shaam Asar Ki
Kidhar Jaraha Hai Kya Main Ne Baat Khatam Ki?!
Banadunga Teri Jannat Main Dozakh Si
Zaban Yeh Tere Pakke Dushman Ki..
You Might Also Like[Hook]
Main Teri Nas Nas Mein, Main Tere Khuaabon Mein
Main Tere Raste Mein, Main Teri Yaadon Mein,.
Main Teri Nas Nas Mein, Main Tere Khuabon Mein
Main Tere Kaagaaz Pe, Main Teri Yaadon Mein

[Verse 2]
Dekh Kaise Badlihaaz Se Tere Ghar Waale!
Bhoolgae Lihaaz Teri Bhi Umar Ka Yeh!
Taar Kya Raha Hai Tu In Sab Ka Sar Phaar De!
Ya Rakh Ke Chehre Pe Iske Thappad Maarde!
(Slap) Yousuf Waali Kismat..
Thappad Maarke Kabhi Milti Ni Izzat..
Apnon Se Nadir - Ese Tou Chirr Matt
Paise Phekde Khatam Mushkil Wakt..

Per Izzat Tujhe Inki Kyun Chaahiye?
Jinki Nafrat Tujhe Saaf Dikhai De
Tabah Jo Tujhe Karne Ka Sochen Tanhai Mein
Jataake Phekden Madad Saari Khaai Mein
Huh Koi Bhi Madad Muft Mein Ni Karta
Koi Bhi Yeh Dozakkh Wozakh Se Ni Darta
Kya Nikah Kya Quran Kya Pardah?!
Purani Soch Teri, Zamana Beparwah!!

Kabhi Tu Tapta Hai, Roke, Kabhi Tu Hasta Hai
Tasweeron Mein Inhe Tu Pagal Sa Lagta Hai
Kabbi Kambakht Sa Kabhi Dilon Mein Basta Hai
Tujhe Smjhna - Kashmir Wala Masla Hai!!!!
Asla Hai Dekho Iske Haathon Mein Asla Hai!
Isko Na Sunna  Yeh Pakistani Kambakht Sa Hai!!!
Views Mashoori Ke Liye Yeh Tarasta Hai!!!
""Phir Khulla Kyun Yeh Modi Ko Dehshat Gard Bakta Hai......??""
Agar Tujhe Million Views Pe Aage Tikna Hai
Tou Qaum Ko Bhoolja Inpe Kyun Gaane Likhta Hai??
Inhe Koi Ni Parwah Inhe Naa Yeh Dikhta Hai
Ke Aaade Se Ziada Gaane Daawat E Zina Hai
Akela Tu Kuch Ni Karskta Yeh Wakti Mashoori Ke Din Do Chaar Zara Gin Jaake
Aina Dekh Aur Pooch Apne Aapse Ke Teri Aukaat Kia Mere Bina Yeh??

[Hook]
Main Teri Nas Nas Mein, Main Tere Khuaabon Mein
Main Tere Raste Mein, Main Teri Yaadon Mein
Main Teri Nas Nas Mein, Main Tere Khuabon Mein
Main Tere Kaagaaz Pe, Main Teri Yaadon Meinembed"
"[{'external_urls': {'spotify': 'https://open.spotify.com/artist/00sCATpEvwH48ays7PlQFU'}, 'href': 'https://api.spotify.com/v1/artists/00sCATpEvwH48ays7PlQFU', 'id': '00sCATpEvwH48ays7PlQFU', 'name': 'Jonita Gandhi', 'type': 'artist', 'uri': 'spotify:artist:00sCATpEvwH48ays7PlQFU'}, {'external_urls': {'spotify': 'https://open.spotify.com/artist/4YRxDV8wJFPHPTeXepOstw'}, 'href': 'https://api.spotify.com/v1/artists/4YRxDV8wJFPHPTeXepOstw', 'id': '4YRxDV8wJFPHPTeXepOstw', 'name': 'Arijit Singh', 'type': 'artist', 'uri': 'spotify:artist:4YRxDV8wJFPHPTeXepOstw'}]",320828,5ELZucrxfmkBOPP9JhfDIf,Aahista,1RNEvKlb3YovuiE8Gw5VOO,11,Laila Majnu ,2018-10-30,"[{'external_urls': {'spotify': 'https://open.spotify.com/artist/3Qol2r2jehhR5yKbmk1Dg4'}, 'href': 'https://api.spotify.com/v1/artists/3Qol2r2jehhR5yKbmk1Dg4', 'id': '3Qol2r2jehhR5yKbmk1Dg4', 'name': 'Niladri Kumar', 'type': 'artist', 'uri': 'spotify:artist:3Qol2r2jehhR5yKbmk1Dg4'}, {'external_urls': {'spotify': 'https://open.spotify.com/artist/1UdYhDdrXVNJMAKghjdU6v'}, 'href': 'https://api.spotify.com/v1/artists/1UdYhDdrXVNJMAKghjdU6v', 'id': '1UdYhDdrXVNJMAKghjdU6v', 'name': 'Joi Barua', 'type': 'artist', 'uri': 'spotify:artist:1UdYhDdrXVNJMAKghjdU6v'}, {'external_urls': {'spotify': 'https://open.spotify.com/artist/745oUlBO0YnhDcFIXS3SPL'}, 'href': 'https://api.spotify.com/v1/artists/745oUlBO0YnhDcFIXS3SPL', 'id': '745oUlBO0YnhDcFIXS3SPL', 'name': 'Alif', 'type': 'artist', 'uri': 'spotify:artist:745oUlBO0YnhDcFIXS3SPL'}]",Niladri Kumar,3Qol2r2jehhR5yKbmk1Dg4,both,"[鹿目まどか(Cv:悠木碧)「またあした」羅馬拼音歌詞]

[Intro]
""Sore Ja Mata Ne"" Tte Te Wo Futte
Muri Ni Waratte Samishiku Natte

[Verse 1]
Hodoukyou Jitensha Kakaete Noboru Hito
Konbini Dareka No Uwasabanashi
Kousaten Shingou Tooku No Kurakushon
Shiranai Dareka No Warai Au Koe

[Pre-Chorus]
Kyou Wa Hitori De Aruku Kayoi Nareta Machi
Demo Itsumo Yori Mo Nandaka
Jibun Ga Chotto Chiisaku Omoeru Yo

[Chorus]
""Sore Ja Mata Ne"" Tte Te Wo Futte
Egao Tsukutte Samishiku Natte
Honto Wa Mada Hanashi Tarinai Kedo
""Sore Ja Mata Ne"" Tte Kotoba Tte
Mata Aeru Tte Uso Wo Tsuite
Itsumodoori No Egao De Iu Yo
""Mata Ashita""
You Might Also Like[Verse 2]
Hitori Ni Wa Nareteru Furi Wo Shiteru Kedo
Honto Wa Sonna Ni Tsuyokunaishi
Itsumo To Onaji Keshiki Itsumo To Onaji Machi
Nani Mo Kawaranai Hazu Na Noni
Jibun Dake Ga Chiisaku Omoeru Yo

[Chorus]
""Sore Ja Mata Ne"" Janakutte
""Ato Sukoshi"" Tte Ieba Yokatta
Ki Ga Tsuite Hoshikute Kitai Shiteita Kedo
""Sore Ja Mata Ne"" Tte Kotoba De
Mata Jibun Ni Uso Wo Tsuite
Itsumodoori No Egao De Kakusu Kono Kimochi

[Interlude]

[Chorus]
""Sore Ja Mata Ne"" Tte Te Wo Futte
Egao Tsukutte Samishiku Natte
Honto Wa Mada Hanashi Tarinai Kedo
""Sore Ja Mata Ne"" Tte Koe Sae
Todokanai Hodo Chikakute Tooi
Itsumodoori Ni Ato Ichido Dake Iwasete
""Mata Ashita.""Embed"
"[{'external_urls': {'spotify': 'https://open.spotify.com/artist/3gBKY0y3dFFVRqicLnVZYz'}, 'href': 'https://api.spotify.com/v1/artists/3gBKY0y3dFFVRqicLnVZYz', 'id': '3gBKY0y3dFFVRqicLnVZYz', 'name': 'Alka Yagnik', 'type': 'artist', 'uri': 'spotify:artist:3gBKY0y3dFFVRqicLnVZYz'}, {'external_urls': {'spotify': 'https://open.spotify.com/artist/4YRxDV8wJFPHPTeXepOstw'}, 'href': 'https://api.spotify.com/v1/artists/4YRxDV8wJFPHPTeXepOstw', 'id': '4YRxDV8wJFPHPTeXepOstw', 'name': 'Arijit Singh', 'type': 'artist', 'uri': 'spotify:artist:4YRxDV8wJFPHPTeXepOstw'}]",341054,3hkC9EHFZNQPXrtl8WPHnX,Agar Tum Saath Ho,2CUXo26JAWIbQx0EVMnjpA,9,Tamasha,2015-10-16,"[{'external_urls': {'spotify': 'https://open.spotify.com/artist/1mYsTxnqsietFxj1OgoGbG'}, 'href': 'https://api.spotify.com/v1/artists/1mYsTxnqsietFxj1OgoGbG', 'id': '1mYsTxnqsietFxj1OgoGbG', 'name': 'A.R. Rahman', 'type': 'artist', 'uri': 'spotify:artist:1mYsTxnqsietFxj1OgoGbG'}, {'external_urls': {'spotify': 'https://open.spotify.com/artist/3GdSQUH1BRtl9UrrtuwJlP'}, 'href': 'https://api.spotify.com/v1/artists/3GdSQUH1BRtl9UrrtuwJlP', 'id': '3GdSQUH1BRtl9UrrtuwJlP', 'name': 'Irshad Kamil', 'type': 'artist', 'uri': 'spotify:artist:3GdSQUH1BRtl9UrrtuwJlP'}]",A.R. Rahman,1mYsTxnqsietFxj1OgoGbG,both,"Pal Bhar Thahar Jaao
Dil Ye Sambhal Jaaye
Kaise Tumhe Roka Karun
Meri Taraf Aata Har
Gham Phisal Jaaye
Aankhon Mein Tum Ko Bharun
Bin Bole Baatein Tumse Karun
‘Gar Tum Saath Ho
Agar Tum Saath Ho
Behti Rehti
Nahar Nadiya Si
Teri Duniya Mein
Meri Duniya Hai
Teri Chaahaton Mein
Main Dhal Jaati Hoon
Teri Aadaton Mein
‘Gar Tum Saath Ho
Teri Nazron Mein
Hai Tere Sapne
Tere Sapno Mein
Hai Naraazi
Mujhe Lagta Hai
Ke Baatein Dil Ki
Hoti Lafzon Ki Dhokebaazi
Tum Saath Ho Ya Na
Ho Kya Fark Hai
Bedard Thi Zindagi Bedard Hai
Agar Tum Saath Ho
Agar Tum Saath Ho
Palkein Jhapakte
Hi Din Ye Nikal Jaaye
Baithi Baithi Bhaagi Phirun
Meri Taraf Aata Har
Gham Phisal Jaaye
Aankhon Mein Tum Ko Bharun
Bin Bole Baatein Tumse Karun
‘Gar Tum Saath Ho
Agar Tum Saath Ho
Teri Nazron Mein
Hai Tere Sapne
Tere Sapno Mein
Hai Naraazi
Mujhe Lagta Hai
Ke Baatein Dil Ki
Hoti Lafzon Ki Dhokebaazi
Tum Saath Ho Ya Na
Ho Kya Fark Hai
Bedard Thi Zindagi Bedard Hai
Agar Tum Saath Ho
Dil Ye Sambhal Jaaye
Agar Tum Saath Ho
Har Gham Phisal Jaaye
Agar Tum Saath Ho
Din Ye Nikal Jaaye
Agar Tum Saath Ho
Har Gham Phisal Jaayeyou Might Also Likeembed"
"[{'external_urls': {'spotify': 'https://open.spotify.com/artist/4YRxDV8wJFPHPTeXepOstw'}, 'href': 'https://api.spotify.com/v1/artists/4YRxDV8wJFPHPTeXepOstw', 'id': '4YRxDV8wJFPHPTeXepOstw', 'name': 'Arijit Singh', 'type': 'artist', 'uri': 'spotify:artist:4YRxDV8wJFPHPTeXepOstw'}, {'external_urls': {'spotify': 'https://open.spotify.com/artist/6iv4lysB1yHXoZJ2gfqTdh'}, 'href': 'https://api.spotify.com/v1/artists/6iv4lysB1yHXoZJ2gfqTdh', 'id': '6iv4lysB1yHXoZJ2gfqTdh', 'name': 'Shashwat Singh', 'type': 'artist', 'uri': 'spotify:artist:6iv4lysB1yHXoZJ2gfqTdh'}]",298492,56QlBs4D15jQWukc0hLCDI,Wat Wat Wat,2CUXo26JAWIbQx0EVMnjpA,9,Tamasha,2015-10-16,"[{'external_urls': {'spotify': 'https://open.spotify.com/artist/1mYsTxnqsietFxj1OgoGbG'}, 'href': 'https://api.spotify.com/v1/artists/1mYsTxnqsietFxj1OgoGbG', 'id': '1mYsTxnqsietFxj1OgoGbG', 'name': 'A.R. Rahman', 'type': 'artist', 'uri': 'spotify:artist:1mYsTxnqsietFxj1OgoGbG'}, {'external_urls': {'spotify': 'https://open.spotify.com/artist/3GdSQUH1BRtl9UrrtuwJlP'}, 'href': 'https://api.spotify.com/v1/artists/3GdSQUH1BRtl9UrrtuwJlP', 'id': '3GdSQUH1BRtl9UrrtuwJlP', 'name': 'Irshad Kamil', 'type': 'artist', 'uri': 'spotify:artist:3GdSQUH1BRtl9UrrtuwJlP'}]",A.R. Rahman,1mYsTxnqsietFxj1OgoGbG,both,"[いきものがかり「花は桜 君は美し」羅馬拼音歌詞]

Hana Wa Sakura Kimi Wa Utsukushi
Haru No Komorebi Kimi No Hohoemi
Fuyu Ga Owari Yuki Ga Tokete
Kimi No Kokoro Ni Haru Ga Maikomu

Mado Wo Tataku Tsuyoi Ame Wa Mada Tsuzuku To
Rajio Kara Nagareru Koe Ga Tsutaete Imasu
Denwa Kara Kikoeta Koe Wa Naite Imashita
Wasureta Hazu No Natsukashii Koe Deshita

Kimi Wa Mata Mou Ichido
Ano Koro Ni Modoritai No Deshou Ka
Haru Wo Matsu Tsubomi No You Ni
Boku Wa Ima Mayotte Imasu

Hana Wa Sakura Kimi Wa Utsukushi
Haru No Komorebi Kimi No Hohoemi
Fuyu Ga Owari Yuki Ga Tokete
Kimi No Kokoro Ni Haru Ga Maikomu

Kawaranu Machi No Keshiki Ga Oshieru No Wa
Hitotsu Dake Koko Ni Tarinai Mono Deshita
""Itsumo No Basho"" To Kimete Ita Eki No Mae
Yure Ugoku Kokoro Ga Boku Wo Segasemasu
You Might Also Likekimi Wa Mata Mou Ichido
Kimi No Te Wo Nigiritai No Deshou Ka
Haru Wo Idaku Kasumi No You Ni
Boku Wa Ima Yuraide Imasu

Hana Wa Kaori Kimi Wa Uruwashi
Minamo Ni Ukabu Hikari Ga Odoru
Kaze Ga Sawagi Machi Wa Iromeku
Boku No Kokoro Wa Haru Ni Tomadou

Haru Wa Mata Mou Ichido
Kono Hana Wo Sakasetai No Deshou Ka
Boku Wo Matsu Kimi No Kasa Ga
Ano Eki Ni Hiraite Imasu


Hana Wa Sakura Kimi Wa Utsukushi
Haru No Komorebi Kimi No Hohoemi
Toki Ni Moeru Haru No Toiki
Futari No Toki Ga Haru Ni Kasanaru

Hana Wa Sakura Kimi Wa Utsukushi
Haru No Komorebi Kimi No Hohoemi
Fuyu Ga Owari Yuki Ga Tokete
Kimi No Kokoro Ni Haru Ga Maikomuembed"
"[{'external_urls': {'spotify': 'https://open.spotify.com/artist/1wRPtKGflJrBx9BmLsSwlU'}, 'href': 'https://api.spotify.com/v1/artists/1wRPtKGflJrBx9BmLsSwlU', 'id': '1wRPtKGflJrBx9BmLsSwlU', 'name': 'Pritam', 'type': 'artist', 'uri': 'spotify:artist:1wRPtKGflJrBx9BmLsSwlU'}, {'external_urls': {'spotify': 'https://open.spotify.com/artist/4YRxDV8wJFPHPTeXepOstw'}, 'href': 'https://api.spotify.com/v1/artists/4YRxDV8wJFPHPTeXepOstw', 'id': '4YRxDV8wJFPHPTeXepOstw', 'name': 'Arijit Singh', 'type': 'artist', 'uri': 'spotify:artist:4YRxDV8wJFPHPTeXepOstw'}]",258036,5qtEWwRUX3GKgpWwDQf9SA,Woh Din,2Svje8vKEM4VCKxoRyAvA4,7,Chhichhore,2019-08-31,"[{'external_urls': {'spotify': 'https://open.spotify.com/artist/1wRPtKGflJrBx9BmLsSwlU'}, 'href': 'https://api.spotify.com/v1/artists/1wRPtKGflJrBx9BmLsSwlU', 'id': '1wRPtKGflJrBx9BmLsSwlU', 'name': 'Pritam', 'type': 'artist', 'uri': 'spotify:artist:1wRPtKGflJrBx9BmLsSwlU'}]",Pritam,1wRPtKGflJrBx9BmLsSwlU,both,"[Verse 1]
Yaado Ke Purane Album Mein
Chhupa Ke Rakhe Hai Humne Woh Din
Hmmm, Gullak Mein Padi Chawani Si
Bacha Ke Rakkhe Hai Humne Woh Din
Na Kisi Manjil Ki Fikar Thi
Zindagi Jeene Ki Umar Thi
Dosti Aur Doston Se Udhaar Ke Din The

[Chorus]
Woh Din Bhi Kya Din The
Wo Oh Wo
Woh Din Bhi Kya Din The
Wo Oh Wo
Woh Din Bhi Kya Din The
Wo Oh Wo
Woh Din Bhi Kya Din The
Wo Oh Wo

[Verse 2]
Bigde Huve Insaan The
Shaitan Ki Santaan The
Ho Lekin Brother Jo Bhi Kaho
Wo Yaar Hi To Jaan The
College Ki Kudi Se
Karne Aankhe Chaar Ke Din The
Aaye Zindagi Mein Pehle Pehle
Pyaar Ke Din The Hey Ae
You Might Also Like[Chorus]
Woh Din Bhi Kya Din The
Wo Oh Wo
Woh Din Bhi Kya Din The
Wo Oh Wo
Woh Din Bhi Kya Din The

[Verse 3]
Hmmm, Kharbujon Ko Kharbujon Ki
Mili Si Sangat Ke Apne Wo Din
Jeewan Pe Chadhi Jawaani Ki
Nayi Si Rangat Ke Apne Wo Din
Yaad Hai Filmon Ke Purane
R D Burman Ke Wo Gaane
Band Ke Keyboard Ke
Aur Guitar Ke Din The

[Chorus]
Woh Din Bhi Kya Din The
Wo Oh Wo
Woh Din Bhi Kya Din The
Wo Oh Wo
Woh Din Bhi Kya Din The
Wo Oh Wo
Woh Din Bhi Kya Din The
Wo Oh Woembed"
"[{'external_urls': {'spotify': 'https://open.spotify.com/artist/1wRPtKGflJrBx9BmLsSwlU'}, 'href': 'https://api.spotify.com/v1/artists/1wRPtKGflJrBx9BmLsSwlU', 'id': '1wRPtKGflJrBx9BmLsSwlU', 'name': 'Pritam', 'type': 'artist', 'uri': 'spotify:artist:1wRPtKGflJrBx9BmLsSwlU'}, {'external_urls': {'spotify': 'https://open.spotify.com/artist/4YRxDV8wJFPHPTeXepOstw'}, 'href': 'https://api.spotify.com/v1/artists/4YRxDV8wJFPHPTeXepOstw', 'id': '4YRxDV8wJFPHPTeXepOstw', 'name': 'Arijit Singh', 'type': 'artist', 'uri': 'spotify:artist:4YRxDV8wJFPHPTeXepOstw'}]",280281,5O932cZmzOZGOGZz9RHx20,Khairiyat,2Svje8vKEM4VCKxoRyAvA4,7,Chhichhore,2019-08-31,"[{'external_urls': {'spotify': 'https://open.spotify.com/artist/1wRPtKGflJrBx9BmLsSwlU'}, 'href': 'https://api.spotify.com/v1/artists/1wRPtKGflJrBx9BmLsSwlU', 'id': '1wRPtKGflJrBx9BmLsSwlU', 'name': 'Pritam', 'type': 'artist', 'uri': 'spotify:artist:1wRPtKGflJrBx9BmLsSwlU'}]",Pritam,1wRPtKGflJrBx9BmLsSwlU,both,"[Chorus]
Khairiyat Pucho, Kabhi To Kaifiyat Pucho
Tumhaare Bin Deewane Ka Kya Haal Hai
Dil Mera Dekho, Na Meri Haisiyat Poocho
Tere Bin Ek Din Jaise Sau Saal Hai

[Post-Chorus]
Anjaam Hai Tay Mera, Hona Tumhein Hai Mera
Jitni Bhi Ho Dooriyan Filhaal Hain
Ye Dooriyan Filhaal Hain

[Chorus]
Ho, Khairiyat Pucho, Kabhi To Kaifiyat Pucho
Tumhaare Bin Deewane Ka Kya Haal Hai
Dil Mera Dekho, Na Meri Haisiyat Poocho
Tere Bin Ek Din Jaise Sau Saal Hai

[Verse]
Tumhaari Tasveer Ke Sahaare, Mausam Kai Guzare
Mausami Na Samjho Par Ishq Ko Humare
Nazron Ke Saamne Main Aata Nahi Tumhare
Magar Rehte Ho Har Pal Manzar Mein Tum Humare
Gar Ishq Se Hain Mila, Phir Dard Se Kya Gila?
Iss Dard Mein Zindagi Khushhaal Hai
Ye Dooriyan Filhaal Hain
You Might Also Like[Chorus]
Ho, Khairiyat Pucho, Kabhi To Kaifiyat Pucho
Tumhaare Bin Deewane Ka Kya Haal Hai
Dil Mera Dekho, Na Meri Haisiyat Poocho
Tere Bin Ek Din Jaise Sau Saal Hai

[Post-Chorus]
Anjaam Hai Tay Mera, Hona Tumhein Hai Mera
Jitni Bhi Ho Dooriyan Filhaal Hain
Ye Dooriyan Filhaal Hainembed"
"[{'external_urls': {'spotify': 'https://open.spotify.com/artist/1wRPtKGflJrBx9BmLsSwlU'}, 'href': 'https://api.spotify.com/v1/artists/1wRPtKGflJrBx9BmLsSwlU', 'id': '1wRPtKGflJrBx9BmLsSwlU', 'name': 'Pritam', 'type': 'artist', 'uri': 'spotify:artist:1wRPtKGflJrBx9BmLsSwlU'}, {'external_urls': {'spotify': 'https://open.spotify.com/artist/4YRxDV8wJFPHPTeXepOstw'}, 'href': 'https://api.spotify.com/v1/artists/4YRxDV8wJFPHPTeXepOstw', 'id': '4YRxDV8wJFPHPTeXepOstw', 'name': 'Arijit Singh', 'type': 'artist', 'uri': 'spotify:artist:4YRxDV8wJFPHPTeXepOstw'}]",270706,3oM90C4SZLYzVZJEZD5EQk,Khairiyat (Bonus Track),2Svje8vKEM4VCKxoRyAvA4,7,Chhichhore,2019-08-31,"[{'external_urls': {'spotify': 'https://open.spotify.com/artist/1wRPtKGflJrBx9BmLsSwlU'}, 'href': 'https://api.spotify.com/v1/artists/1wRPtKGflJrBx9BmLsSwlU', 'id': '1wRPtKGflJrBx9BmLsSwlU', 'name': 'Pritam', 'type': 'artist', 'uri': 'spotify:artist:1wRPtKGflJrBx9BmLsSwlU'}]",Pritam,1wRPtKGflJrBx9BmLsSwlU,both,"[Hook]
Kiski Khaer Kiski Khaer
Kon Hai Gaer Kon Hai Gaer
Kesa Zeher Kesa Zeher
Kisse Baer Kisse Baer X2

[Verse 1]
Kitna Uthate Ho Kitna Girate Ho
Ek Mahine Ka Kitna Kamate Ho
Jitna Parosa H Utna Hi Khate Ho
Padho Likho Kyu Ye Gaane Banate Ho
Chillake Kamre Mei Gaane Kyu Gaate Ho
Karte Ho Kam Kitni Batein Banate Ho
Latein Kaha Se Ye Shabd Ghumate Ho
Bholi Shakal Se Yun Kisko Fasate Ho
Yaha Jali Teri Chitah Toh Fir Rakh Hai Bete
Yaha Khel Khatam Sogaat Hai Bete
Kar Ke Dikha Agar Teri Aukkat Hai Bete?
Aur Ye Kala Nahi Mili Khairaat Mei Bete
Ghisi Najane Kitni Raatein Batein
Tabhi Yaha Thodi Si Jagaah Pe Yaha Aake Bethe
Ab Raas Kaha Aayega Jab Koi Aake Kehde Ki
Aap Mazze Mei Ho Full Nhi Aap Ni Sehte
Jeb Mei Daalo Apni Rai Ye
Kal Koi Nahi Aaj Bhai Hai?
5 Saal Se Humne Marai
Ye Gaana Uski Numaish Hai
Aage Kua Piche Khai Hai
Aaj Beat Ki Godd Bharai Hai
Chalti Zubaan Chalne Do Isko
Koi Dikkat Nahi Hum Nayi Hai
Tum Blackbuck Hum Bhai Hai
Kal The Sabhya Aaj Hum Wild Hai
Gharelu Hinsa Hip Hop Me Kari
Fir Biwi Bhage Apne Mayke
Ek Hath Mei Roll Kiya Hua J
Aur Dusre Wale Mei Mic Hai
Barabri Ki Koshish Bhi Nhi
Tum Gully Boy 8 Mile Mei
You Might Also Like[Hook]
Kiski Khaer Kiski Khaer
Kon Hai Gaer Kon Hai Gaer
Kesa Zeher Kesa Zeher
Kisse Baer Kisse Baer X2

[Verse 2]
Dekho Abhi Bane Ye Shabd Mere Khilone
Betha Hua Bhand, Tha Tabhi Apni Zone Hai
Call Dronark Ko, Bola Scene On Hai
Fir Drop Kiya Gaanaa Humne Sabne Pucha Kon Hai
Thoda Nahi Kaaafi Ye Lamba Safar
Hota Nahi Mujko Ab Bilkul Sabar
Nahi Chodu Itni Si Bhi Me Kasar
Bakaiti Nhi Humse Na Lena Bhasad
Tum
Ziddi Nasal Meri Zidd Pe Hoon Ada
Tabhi Toh Hoon Aaj Bhi Yaha Pe Khada
Pesa Hai Bonus Par Jeb Se Nahi
Insaan Hota Hai Apne Kaam Se Bada
Naam Se Bada Fir Ye Paanv Ye Badha
Insaan Ki Tarakki Se Insaan Hi Sada?
Hua Sanghar Agar Papi Se Pala Jo Pada
Me Failunnga Corona Virus Ki Tarah

Snapback Wali Cap Nahi Pehni Kali Hoodie Booom Bap Wali Rap Nahi
Bakiyo Ki Tarah Whack Nhi, Flow Kabhi Fast Par Rehta Koi Track Ni
Aag Hai Track Pe Mila Nahi Todd Hai
Baki Thakk Ke Beth Gaye, Hum Lambi Race Ke Ghode
Yakeen Ni Hota Abhi Bhi Log Sorahe
14 Saal Ki Umaar Mei Hip Hop Se Tha Vyah
Jese Balika Vadhu Ka Episode Haiembed"
"[{'external_urls': {'spotify': 'https://open.spotify.com/artist/1wRPtKGflJrBx9BmLsSwlU'}, 'href': 'https://api.spotify.com/v1/artists/1wRPtKGflJrBx9BmLsSwlU', 'id': '1wRPtKGflJrBx9BmLsSwlU', 'name': 'Pritam', 'type': 'artist', 'uri': 'spotify:artist:1wRPtKGflJrBx9BmLsSwlU'}, {'external_urls': {'spotify': 'https://open.spotify.com/artist/0ySU451Z1RKPLEjrjeJCTB'}, 'href': 'https://api.spotify.com/v1/artists/0ySU451Z1RKPLEjrjeJCTB', 'id': '0ySU451Z1RKPLEjrjeJCTB', 'name': 'Hamsika', 'type': 'artist', 'uri': 'spotify:artist:0ySU451Z1RKPLEjrjeJCTB'}, {'external_urls': {'spotify': 'https://open.spotify.com/artist/4YRxDV8wJFPHPTeXepOstw'}, 'href': 'https://api.spotify.com/v1/artists/4YRxDV8wJFPHPTeXepOstw', 'id': '4YRxDV8wJFPHPTeXepOstw', 'name': 'Arijit Singh', 'type': 'artist', 'uri': 'spotify:artist:4YRxDV8wJFPHPTeXepOstw'}, {'external_urls': {'spotify': 'https://open.spotify.com/artist/4WE5a7bSjZ1IDwwSIuW3YM'}, 'href': 'https://api.spotify.com/v1/artists/4WE5a7bSjZ1IDwwSIuW3YM', 'id': '4WE5a7bSjZ1IDwwSIuW3YM', 'name': 'Joi', 'type': 'artist', 'uri': 'spotify:artist:4WE5a7bSjZ1IDwwSIuW3YM'}]",287651,6BQWmYuo5aO5och7iUg6Oj,Raabta (Siyaah Raatein),2DqQ34i4uuuZWTScsGIgHr,12,Agent Vinod,2012-02-24,"[{'external_urls': {'spotify': 'https://open.spotify.com/artist/1wRPtKGflJrBx9BmLsSwlU'}, 'href': 'https://api.spotify.com/v1/artists/1wRPtKGflJrBx9BmLsSwlU', 'id': '1wRPtKGflJrBx9BmLsSwlU', 'name': 'Pritam', 'type': 'artist', 'uri': 'spotify:artist:1wRPtKGflJrBx9BmLsSwlU'}]",Pritam,1wRPtKGflJrBx9BmLsSwlU,both,"Faili Thi Siyaah Raatein, Aaya Toh Subah Leke
Bewajah Si Zindagi Mein Jeene Ki Wajah Leke
Khoya Tha Samundaron Mein, Tanha Safeena Mera
Saahilon Pe Aaya Hai, Tu Jaane Kis Tarah Haan Leke
Faili Thi Siyaah Raatein, Aaya Toh Subah Leke
Bewajah Si Zindagi Mein Jeene Ki Wajah Leke
Khoya Tha Samundaron Mein, Tanha Safeena Mera
Saahilon Pe Aaya Hai, Tu Jaane Kis Tarah Haan Leke
Kuch Toh Hai Tujhse Raabta
Kuch Toh Hai Tujhse Raabta
Kaise Hum Jaane Hume Kya Pata
Kuch Toh Hai Tujhse Raabta
Ab Kya Hai Kehna, Humko Hai Rehna
Jannatein Bhula Ke Teri Baahon Mein Mein Panah Leke
Faili Thi Siyaah Raatein, Aaya Toh Subah Leke
Bewajah Si Zindagi Mein Jeene Ki Wajah Leke

Sa Ni Pa Di Na Sa..

Meharbaani Jaate Jaate Mujh Pe Kar Gaya
Guzarta Sa Lamha Ek Daaman Bhar Gaya
Tere Nazara Mila, Roshan Sitaara Mila
Takdeer Ka Jaise Koi Ishaara Mila

Roothi Hui Khwaishon Mein Thodi Si Sulah Leke
Aaya Tu Khamoshiyon Mein, Baaton Ki Chirah Leke
Khoya Tha Samundaron Mein, Tanha Safeena Mera
Saahilon Pe Aaya Hai, Tu Jaane Kis Tarah Haan Leke
Faili Thi Siyaah Raatein, Aaya Toh Subah Leke
Bewajah Si Zindagi Mein Jeene Ki Wajah Leke
Khoya Tha Samundaron Mein, Tanha Safeena Mera
Saahilon Pe Aaya Hai, Tu Jaane Kis Tarah Haan Leke
Kuch Toh Hai Tujhse Raabta
Kuch Toh Hai Tujhse Raabta
Kaise Hum Jaane Hume Kya Pata
Kuch Toh Hai Tujhse Raabta
Ab Kya Hai Kehna, Humko Hai Rehna
Jannatein Bhula Ke Teri Baahon Mein Mein Panah Leke
Faili Thi Siyaah Raatein, Aaya Toh Subah Leke
Bewajah Si Zindagi Mein Jeene Ki Wajah Leke
You Might Also Likei Feel It Inside
Don'T Know Why
I Feel It Insideembed"
