Track_Artists,duration_ms,id,Track_Name,Album_ID,total_tracks,Album_Name,release_date,Album_Artists,Producer,Producer_ID,_merge,Lyrics
"[{'external_urls': {'spotify': 'https://open.spotify.com/artist/1wRPtKGflJrBx9BmLsSwlU'}, 'href': 'https://api.spotify.com/v1/artists/1wRPtKGflJrBx9BmLsSwlU', 'id': '1wRPtKGflJrBx9BmLsSwlU', 'name': 'Pritam', 'type': 'artist', 'uri': 'spotify:artist:1wRPtKGflJrBx9BmLsSwlU'}, {'external_urls': {'spotify': 'https://open.spotify.com/artist/4YRxDV8wJFPHPTeXepOstw'}, 'href': 'https://api.spotify.com/v1/artists/4YRxDV8wJFPHPTeXepOstw', 'id': '4YRxDV8wJFPHPTeXepOstw', 'name': 'Arijit Singh', 'type': 'artist', 'uri': 'spotify:artist:4YRxDV8wJFPHPTeXepOstw'}]",289333,0H2iJVgorRR0ZFgRqGUjUM,Channa Mereya,5xjaz957o6YGSXmlfd2tex,9,Ae Dil Hai Mushkil  [Deluxe Edition],2016-10-26,"[{'external_urls': {'spotify': 'https://open.spotify.com/artist/1wRPtKGflJrBx9BmLsSwlU'}, 'href': 'https://api.spotify.com/v1/artists/1wRPtKGflJrBx9BmLsSwlU', 'id': '1wRPtKGflJrBx9BmLsSwlU', 'name': 'Pritam', 'type': 'artist', 'uri': 'spotify:artist:1wRPtKGflJrBx9BmLsSwlU'}]",Pritam,1wRPtKGflJrBx9BmLsSwlU,both,"[Verse 1]
Aaccha Chalta Hoon
Duaaon Mein Yaad Rakhna
Mere Zikr Ka Zubaan Pe Suaad Rakhana
Aacha Chalta Hoon
Duaaon Main Yaad Rakhna
Mere Zikr Ka Zubaan Pe Suaad Rakhana

Dil Ke Sandookon Mein
Mere Acche Kaam Rakhna
Chitthi Taaron Mein Bhi
Mera Tu Salaam Rakhna

[Pre-Chorus]
Andhera Tera, Maine Le Liya
Mera Ujla Sitaara Tere Naam Kiya

[Chorus]
Channa Mereya Mereya
Channa Mereya Mereya
Channa Mereya Mereya Behliya
O Piya...
Channa Mereya Mereya
Channa Mereya Mereya
Channa Mеreya Mereya Bеhliya
O Piya...
You Might Also Like[Verse 2]
Mehfil Mein Teri
Hum Na Rahein Jo
Gum To Nahi Hai
Gum To Nahi Hai
Quisse Humari Nazdeekiyon Ke
Kum To Nahi Hain
Kum To Nahi Hain

[Pre-Chorus]
Kitni Dafaa, Subha Ko Meri
Tere Aangan Mein Baithe
Maine Shaam Kiya

[Chorus]
Channa Mereya Mereya
Channa Mereya Mereya
Channa Mereya Mereya Behliya
O Piya...
Channa Mereya Mereya
Channa Mereya Mereya
Channa Mereya Mereya Behliya
O Piya...
Channa Mereya Mereya
Channa Mereya Mereya
Channa Mereya Mereya
O Piya...
Channa Mereya Mereya
Channa Mereya Mereya
Channa Mereya Mereya
O Piya...
[Bridge]
Tere Rukh Se Apna Raasta
Mod Ke Chala
Chandan Hoon Mein
Apni Khushboo Chhod Ke Chala...

Maan Ki Maya Rakh Ke
Tere Takiya Tale
Bairaagi, Bairaagi Ka Sooti Chola
Odh Ke Chala...

[Chorus]
Channa Mereya Mereya
Channa Mereya Mereya
Channa Mereya Mereya Behliya
O Piya...
O Piya...Embed"
"[{'external_urls': {'spotify': 'https://open.spotify.com/artist/1wRPtKGflJrBx9BmLsSwlU'}, 'href': 'https://api.spotify.com/v1/artists/1wRPtKGflJrBx9BmLsSwlU', 'id': '1wRPtKGflJrBx9BmLsSwlU', 'name': 'Pritam', 'type': 'artist', 'uri': 'spotify:artist:1wRPtKGflJrBx9BmLsSwlU'}, {'external_urls': {'spotify': 'https://open.spotify.com/artist/4YRxDV8wJFPHPTeXepOstw'}, 'href': 'https://api.spotify.com/v1/artists/4YRxDV8wJFPHPTeXepOstw', 'id': '4YRxDV8wJFPHPTeXepOstw', 'name': 'Arijit Singh', 'type': 'artist', 'uri': 'spotify:artist:4YRxDV8wJFPHPTeXepOstw'}, {'external_urls': {'spotify': 'https://open.spotify.com/artist/0y59o4v8uw5crbN9M3JiL1'}, 'href': 'https://api.spotify.com/v1/artists/0y59o4v8uw5crbN9M3JiL1', 'id': '0y59o4v8uw5crbN9M3JiL1', 'name': 'Badshah', 'type': 'artist', 'uri': 'spotify:artist:0y59o4v8uw5crbN9M3JiL1'}, {'external_urls': {'spotify': 'https://open.spotify.com/artist/00sCATpEvwH48ays7PlQFU'}, 'href': 'https://api.spotify.com/v1/artists/00sCATpEvwH48ays7PlQFU', 'id': '00sCATpEvwH48ays7PlQFU', 'name': 'Jonita Gandhi', 'type': 'artist', 'uri': 'spotify:artist:00sCATpEvwH48ays7PlQFU'}, {'external_urls': {'spotify': 'https://open.spotify.com/artist/4kq8z3vydHjPDggxb16ErB'}, 'href': 'https://api.spotify.com/v1/artists/4kq8z3vydHjPDggxb16ErB', 'id': '4kq8z3vydHjPDggxb16ErB', 'name': 'Nakash Aziz', 'type': 'artist', 'uri': 'spotify:artist:4kq8z3vydHjPDggxb16ErB'}]",252631,5FihcmME7NlwW8KbYOaHVH,The Breakup Song,5xjaz957o6YGSXmlfd2tex,9,Ae Dil Hai Mushkil  [Deluxe Edition],2016-10-26,"[{'external_urls': {'spotify': 'https://open.spotify.com/artist/1wRPtKGflJrBx9BmLsSwlU'}, 'href': 'https://api.spotify.com/v1/artists/1wRPtKGflJrBx9BmLsSwlU', 'id': '1wRPtKGflJrBx9BmLsSwlU', 'name': 'Pritam', 'type': 'artist', 'uri': 'spotify:artist:1wRPtKGflJrBx9BmLsSwlU'}]",Pritam,1wRPtKGflJrBx9BmLsSwlU,both,"[Intro]
Breakup Song, Breakup Song
Karde Dil Ki Feeling Strong
Saade Chaar Minute Long
Breakup Song, Breakup Song
Break Break B B.. Breakup Song
Break Break B B.. Breakup Song

[Verse 1: Jonita Gandhi]
Angrezi Chidiya Ki Khaatir
Desi Dil Mera Tod Diya
Maine Chhod Diya, Usse Chhod Diya
Uski Kaali Kartooton Ne
Uska Bhaanda Phod Diya
Maine Chhod Diya, Usse Chhod Diya

[Pre-Chorus: Jonita Gandhi]
Dil Pe Patthar Rakh Ke
Munh Pe Makeup Kar Liya
Oh Dil Pe Patthar Rakh Ke
Munh Pe Makeup Kar Liya

[Chorus: Jonita Gandhi]
Mere Saiyyan Ji Se Aaj
Maine Breakup Kar Liya
Mere Saiyyan Ji Se Aaj
Maine Breakup Kar Liya
Subah Savere Uth Ke Maine
Ye Sab Kar Liya
Mere Saiyyan Ji Se Aaj
Maine Breakup Kar Liya
You Might Also Like[Pre-Chorus: Arijit Singh]
Humko Bin Bataye Tune Ye Kab Kar Liya?
Are, Humko Bin Bataye Tune Ye Kab Kar Liya?

[Chorus: Arijit Singh & Jonita Gandhi]
O, Tere Saiyyan Ji Se Kaahe Tune Break Up Kar Liya
Tere Saiyyan Ji Se Kaahe Tune Breakup Kar Liya
Subah Savere Uth Ke Maine Ye Sab Kar Liya
Tere Saiyyan Ji Se Kaahe Tune Breakup Kar Liya
तूने ब्रेकअप कर लिया
(B-B-Breakup Song)

[Verse 2: Jonita Gandhi]
Kuch Din To Rona Dhona Bumper Kiya
Aur Phir Delete Uska Number Kiya
Aansu Jo Sookhe Seedha Parlour Gayi
Parlour Mein Jaake Shampoo Jamkar Kiya

[Pre-Chorus: Jonita Gandhi]
College Ki Saheliyon Se Catch-Up Kar Liya
Arey College Ki Saheliyon Se Catch-Up Kar Liya
Jinko Mill Na Paayi Unko Whatsapp Kar Diya

[Chorus: Jonita Gandhi]
Mere Saiyyan Ji Se Aaj Maine Breakup Kar Liya
Subah Savere Uth Ke Maine Ye Sab Kar Liya
Mere Saiyyan Ji Se Aaj Maine Breakup Kar Liya
[Verse 3: Badshah]
Look, Baby Mujhe Lagta Hai Ki
Jo Bhi Tune Kiya Hai Wo Very Very Right Hai
Bhoot-Kaal Ko Bhool Ja Ab Tu
Aane Wala Future Very Very Bright Hai
Main Hoon Na Baby Saath Tere
Party Sharty Honi Poori Night Hai
Mind Na Karna Jo Thoda Zyada Bol Doon
Kyunki Banda Very Very Tight Hai
Usse Phone Mila Aur Gaali De
Photo Jala Ke Karde Raakh
Saale Teri Maa Ki Aankh!

[Verse 4: Arijit Singh]
Kalti Hua Jo Saiyan Stupid Tera
Jeevit Hua Hai Phir Se Cupid Tera
Baasi Relationship Ka Label Hata
Duniya Ko Tu Hai Available Bata

[Pre-Chorus: Arijit Singh]
Are Mere Soye Armaano Ko Wake Up Kar Diya
Are Mere Soye Armaano Ko Wake Up Kar Diya
Ke Tere Saiyan Ji Se (Aaha!)
Tune Breakup Kar Liya

[Chorus: Arijit Singh]
Tere Saiyyan Ji Se Kaahe Tune..
O, Tere Saiyyan Ji Se Kaahe Tune Breakup Kar Liya
Tere Saiyyan Ji Se Kaahe Tune Breakup Kar Liya
[Outro]
B-B-Breakup Song
Karde Dil Ki Feeling Strongembed"
"[{'external_urls': {'spotify': 'https://open.spotify.com/artist/1wRPtKGflJrBx9BmLsSwlU'}, 'href': 'https://api.spotify.com/v1/artists/1wRPtKGflJrBx9BmLsSwlU', 'id': '1wRPtKGflJrBx9BmLsSwlU', 'name': 'Pritam', 'type': 'artist', 'uri': 'spotify:artist:1wRPtKGflJrBx9BmLsSwlU'}, {'external_urls': {'spotify': 'https://open.spotify.com/artist/4YRxDV8wJFPHPTeXepOstw'}, 'href': 'https://api.spotify.com/v1/artists/4YRxDV8wJFPHPTeXepOstw', 'id': '4YRxDV8wJFPHPTeXepOstw', 'name': 'Arijit Singh', 'type': 'artist', 'uri': 'spotify:artist:4YRxDV8wJFPHPTeXepOstw'}, {'external_urls': {'spotify': 'https://open.spotify.com/artist/1cfG7UM0OD4O1II1nd15Qo'}, 'href': 'https://api.spotify.com/v1/artists/1cfG7UM0OD4O1II1nd15Qo', 'id': '1cfG7UM0OD4O1II1nd15Qo', 'name': 'Ash King', 'type': 'artist', 'uri': 'spotify:artist:1cfG7UM0OD4O1II1nd15Qo'}, {'external_urls': {'spotify': 'https://open.spotify.com/artist/6iv4lysB1yHXoZJ2gfqTdh'}, 'href': 'https://api.spotify.com/v1/artists/6iv4lysB1yHXoZJ2gfqTdh', 'id': '6iv4lysB1yHXoZJ2gfqTdh', 'name': 'Shashwat Singh', 'type': 'artist', 'uri': 'spotify:artist:6iv4lysB1yHXoZJ2gfqTdh'}]",282272,3w9EgtkQgMTrlSwuQEFdR0,Alizeh,5xjaz957o6YGSXmlfd2tex,9,Ae Dil Hai Mushkil  [Deluxe Edition],2016-10-26,"[{'external_urls': {'spotify': 'https://open.spotify.com/artist/1wRPtKGflJrBx9BmLsSwlU'}, 'href': 'https://api.spotify.com/v1/artists/1wRPtKGflJrBx9BmLsSwlU', 'id': '1wRPtKGflJrBx9BmLsSwlU', 'name': 'Pritam', 'type': 'artist', 'uri': 'spotify:artist:1wRPtKGflJrBx9BmLsSwlU'}]",Pritam,1wRPtKGflJrBx9BmLsSwlU,both,"[Verse 1]
Pyaar Maine Jo Nibhaya
Tere Rehte, Tere Saath Bhi
Sach Kahun Toh, Uss Se Zyada
Chaha Tujhko, Tere Baad Bhi

[Pre-Chorus]
Hmm, Main Dard Hoon, Tu Dava Hai Na
Main Aag Hoon, Tu Hawa Hai Na

[Chorus]
Ali, Ali, Ali, Alizeh
Ali, Ali, Ali, Alizeh
Kahaan Hain Tu, Mere Dil Mein Hai Na
Ali, Ali, Ali, Alizeh
Ali, Ali, Ali, Alizeh
Tera Hoon Main, Tujhe Yaad Hai Na

Ali, Ali, Ali, Alizeh
Ali, Ali, Ali, Alizeh
Kahaan Hain Tu, Mere Dil Mein Hai Na
Ali, Ali, Ali, Alizeh
Ali, Ali, Ali, Alizeh
Tera Hoon Main, Tujhe Yaad Hai Na

[Verse 2]
Sooraj Dhale Toh Lagta Hai Jaise
Kaandhe Pe Mere Sar Hai Tera
Mera Thikana Chahe Jahaan Ho
Yaadon Mein Meri Ghar Hai Tera
You Might Also Likesooraj Dhale Toh Lagta Hai Jaise
Kaandhе Pe Mere Sar Hai Tеra
Mera Thikana Chahe Jahaan Ho
Yaadon Mein Meri Ghar Hai Tera

[Pre-Chorus]
Main Hoon Jahaan, Tu Wahaan Hai Na
Main Aag Hoon, Tu Hawa Hai Na

[Chorus]
Ali, Ali, Ali, Alizeh
Ali, Ali, Ali, Alizeh
Kahaan Hain Tu, Mere Dil Mein Hai Na
Ali, Ali, Ali, Alizeh
Ali, Ali, Ali, Alizeh
Tera Hoon Main, Tujhe Yaad Hai Na

Ali, Ali, Ali, Alizeh
Ali, Ali, Ali, Alizeh
Kahaan Hain Tu, Mere Dil Mein Hai Na
Ali, Ali, Ali, Alizeh
Ali, Ali, Ali, Alizeh
Tera Hoon Main, Tujhe Yaad Hai Na

[Verse 3]
In The Darkness
You Help Me Find A Spark
The Sweetest Soul With The Kindest Heart
If Only You Could See You The Way I Do
You’D See The Sunshine And It’S Beautiful
Yeah! And All You Have To Do Is Smile
I Give Anything To Be There Just To See It Now
To Lay With You In The Warmth Of The Summers Night
And Watch The Moon And Stars Come To Life
Can’T Begin To Explain Just What You Did For Me
Yeah There Was Something In Your Energy
Close My Eyes And I Still Feel You In Every Breeze
That’S How I Know You’Re Still With Me

I’Ve Died A Thousand Times For You
Walked A Million Miles For You
I’D Live And Still Be Dead, You See
If You’D Be Living Without Meembed"
"[{'external_urls': {'spotify': 'https://open.spotify.com/artist/1wRPtKGflJrBx9BmLsSwlU'}, 'href': 'https://api.spotify.com/v1/artists/1wRPtKGflJrBx9BmLsSwlU', 'id': '1wRPtKGflJrBx9BmLsSwlU', 'name': 'Pritam', 'type': 'artist', 'uri': 'spotify:artist:1wRPtKGflJrBx9BmLsSwlU'}, {'external_urls': {'spotify': 'https://open.spotify.com/artist/4YRxDV8wJFPHPTeXepOstw'}, 'href': 'https://api.spotify.com/v1/artists/4YRxDV8wJFPHPTeXepOstw', 'id': '4YRxDV8wJFPHPTeXepOstw', 'name': 'Arijit Singh', 'type': 'artist', 'uri': 'spotify:artist:4YRxDV8wJFPHPTeXepOstw'}, {'external_urls': {'spotify': 'https://open.spotify.com/artist/19LIHDDSHBD5NyYHI3gpzB'}, 'href': 'https://api.spotify.com/v1/artists/19LIHDDSHBD5NyYHI3gpzB', 'id': '19LIHDDSHBD5NyYHI3gpzB', 'name': 'Shilpa Rao', 'type': 'artist', 'uri': 'spotify:artist:19LIHDDSHBD5NyYHI3gpzB'}]",348965,0FeJltV3BtqpyQZ0hv49oi,Bulleya - Reprise,5xjaz957o6YGSXmlfd2tex,9,Ae Dil Hai Mushkil  [Deluxe Edition],2016-10-26,"[{'external_urls': {'spotify': 'https://open.spotify.com/artist/1wRPtKGflJrBx9BmLsSwlU'}, 'href': 'https://api.spotify.com/v1/artists/1wRPtKGflJrBx9BmLsSwlU', 'id': '1wRPtKGflJrBx9BmLsSwlU', 'name': 'Pritam', 'type': 'artist', 'uri': 'spotify:artist:1wRPtKGflJrBx9BmLsSwlU'}]",Pritam,1wRPtKGflJrBx9BmLsSwlU,both,"[Verse 1: Arijit Singh]
Meri Rooh Ka Parinda Phadphadaaye
Lekin Sukoon Ka Jazeera Mil Na Paaye
Ve Ki Karan? Ve Ki Karan?

Ik Baar Ko Tajalli Toh Dikha De
Jhoothi Sahi Magar Tasalli Toh Dila De
Ve Ki Karan? Ve Ki Karan?

[Chorus: Arijit Singh]
Ranjhan De Yaar Bulleya, Sun Le Pukaar Bulleya
Tu Hi To Yaar Bulleya, Murshid Mera (Murshid Mera)
Tera Mukaam Kamle Sarhad Ke Paar Bulleya
Parvardigar Bulleya, Hafiz Tera (Murshid Mera)

Ranjhan De Yaar Bulleya, Sun Le Pukaar Bulleya
Tu Hi To Yaar Bulleya, Murshid Mera (Murshid Mera)
Tera Mukaam Kamle Sarhad Ke Paar Bulleya
Parvardigar Bulleya, Hafiz Tera, Murshid Mera

[Verse 2: Arijit Singh]
Main Taan Gul Se Lipti Titli Ki Tarah Muhajir Hoon
Ek Pal Ko Thehrun, Pal Mein Udd Jaun
Ve Main Ta Hoon Pagdandi
Labhdi Ae Jo Raah Jannat Di
Tu Mude Jahaan Main Saath Mud Jaun
You Might Also Liketere Kaarwa Mein Shaamil Hona Chahun
Kamiyan Tarash Ke Main Kaabil Hona Chahun
Ve Ki Karan? Ve Ki Karan?

[Chorus: Arijit Singh]
Ranjhan De Yaar Bulleya, Sun Le Pukaar Bulleya
Tu Hi To Yaar Bulleya, Murshid Mera (Murshid Mera)
Tera Mukaam Kamle Sarhad Ke Paar Bulleya
Parvardigar Bulleya, Hafiz Tera (Murshid Mera)

[Verse 3: Shilpa Rao]
(Ranjhana Ve.. Ranjhana Ve..)
Jis Din Se Aashna Se Do Ajnabi Huwe Hai
Tanhayion Ke Lamhein Sab Multavi Huwe Hai
Kyun Aaj Main Mohabbat Phir Ek Baar Karna Chahun

Ye Dil Toh Dhoondta Hai Inkaar Ke Bahane
Lekin Ye Jism Koi Pabandiyan Na Maane
Milke Tujhe Baghawat, Khudse Hi Yaar Karna Chaahun
Mujhme Agan Hai Baaki Aazma Le
Le Kar Rahi Hun Khud Ko Main Tere Hawale
Ve Ranjhana.. Ve Ranjhana..

[Chorus: Arijit Singh]
Ranjhan De Yaar Bulleya, Sun Le Pukaar Bulleya
Tu Hi To Yaar Bulleya, Murshid Mera (Murshid Mera)
Tera Mukaam Kamle Sarhad Ke Paar Bulleya
Parvardigar Bulleya, Hafiz Tera (Murshid Mera)
Ranjhan De Yaar Bulleya, Sun Le Pukaar Bulleya
Tu Hi To Yaar Bulleya, Murshid Mera (Murshid Mera)
Tera Mukaam Kamle Sarhad Ke Paar Bulleya
Parvardigar Bulleya, Hafiz Tera, Murshid Mera

[Outro: Arijit Singh]
Murshid Mera, Murshid Mera, Murshad Meraembed"
"[{'external_urls': {'spotify': 'https://open.spotify.com/artist/1wRPtKGflJrBx9BmLsSwlU'}, 'href': 'https://api.spotify.com/v1/artists/1wRPtKGflJrBx9BmLsSwlU', 'id': '1wRPtKGflJrBx9BmLsSwlU', 'name': 'Pritam', 'type': 'artist', 'uri': 'spotify:artist:1wRPtKGflJrBx9BmLsSwlU'}, {'external_urls': {'spotify': 'https://open.spotify.com/artist/4YRxDV8wJFPHPTeXepOstw'}, 'href': 'https://api.spotify.com/v1/artists/4YRxDV8wJFPHPTeXepOstw', 'id': '4YRxDV8wJFPHPTeXepOstw', 'name': 'Arijit Singh', 'type': 'artist', 'uri': 'spotify:artist:4YRxDV8wJFPHPTeXepOstw'}]",165333,0xHvmWCpz9Pnn1sDvRehAs,Channa Mereya - Unplugged,5xjaz957o6YGSXmlfd2tex,9,Ae Dil Hai Mushkil  [Deluxe Edition],2016-10-26,"[{'external_urls': {'spotify': 'https://open.spotify.com/artist/1wRPtKGflJrBx9BmLsSwlU'}, 'href': 'https://api.spotify.com/v1/artists/1wRPtKGflJrBx9BmLsSwlU', 'id': '1wRPtKGflJrBx9BmLsSwlU', 'name': 'Pritam', 'type': 'artist', 'uri': 'spotify:artist:1wRPtKGflJrBx9BmLsSwlU'}]",Pritam,1wRPtKGflJrBx9BmLsSwlU,both,"[Verse 1]
Mehfil Mein Teri Hum Na Rahein Jo
Gum To Nahi Hai, Gum To Nahi Hai
Quisse Humari Nazdeekiyon Ke
Kum To Nahi Hain, Kum To Nahi Hain

[Pre-Chorus]
Kitni Dafaa, Subha Ko Meri
Tere Aangan Mein Baithe
Maine Shaam Kiya

[Chorus]
Channa Mereya Mereya, Channa Mereya Mereya
Channa Mereya Mereya Beliya
O Piya...
Channa Mereya Mereya, Channa Mereya Mereya
Channa Mereya Mereya Beliya
O Piya...

[Outro]
O Piya, O Piya
O Piya(Hmm)
Ae (Hmm, Ah)
O Piyayou Might Also Likeembed"
"[{'external_urls': {'spotify': 'https://open.spotify.com/artist/1wRPtKGflJrBx9BmLsSwlU'}, 'href': 'https://api.spotify.com/v1/artists/1wRPtKGflJrBx9BmLsSwlU', 'id': '1wRPtKGflJrBx9BmLsSwlU', 'name': 'Pritam', 'type': 'artist', 'uri': 'spotify:artist:1wRPtKGflJrBx9BmLsSwlU'}, {'external_urls': {'spotify': 'https://open.spotify.com/artist/4YRxDV8wJFPHPTeXepOstw'}, 'href': 'https://api.spotify.com/v1/artists/4YRxDV8wJFPHPTeXepOstw', 'id': '4YRxDV8wJFPHPTeXepOstw', 'name': 'Arijit Singh', 'type': 'artist', 'uri': 'spotify:artist:4YRxDV8wJFPHPTeXepOstw'}]",247941,1smFN2CLqGROu0J0UyvDfL,Shayad,6IXfWhC7omotM4lt0ROmEr,11,Love Aaj Kal ,2020-02-14,"[{'external_urls': {'spotify': 'https://open.spotify.com/artist/1wRPtKGflJrBx9BmLsSwlU'}, 'href': 'https://api.spotify.com/v1/artists/1wRPtKGflJrBx9BmLsSwlU', 'id': '1wRPtKGflJrBx9BmLsSwlU', 'name': 'Pritam', 'type': 'artist', 'uri': 'spotify:artist:1wRPtKGflJrBx9BmLsSwlU'}]",Pritam,1wRPtKGflJrBx9BmLsSwlU,both,"[Verse 1]
Shayad Kabhi Na Kehe Saku Main Tum Ko
Kahe Bina Samjhlo Tum Shayad
Shayad Mere Khayalo Mein Tum Ek Din
Milo Mujhe Kahin Pe Ghum Sahayad

[Chorus]
Jo Tum Na Ho, Rahenge Hum Nahi
Jo Tum Na Ho, Rahenge Hum Nahi
Nachahiye Kuch Tumse Zyada, Tum Se Kam Nahi
Jo Tum Na Ho, Toh Hum Bhi Hum Nahi
Jo Tum Na Ho, Toh Hum Bhi Hum Nahi
Nachahiye Kuch Tumse Zyada, Tum Se Kam Nahi

[Verse 2]
Ankho Ko Khwab Dena, Khud Hi Sawal Karke
Khud Hi Jawab Dena, Teri Taraf Se
Bin Kam-Kam Karna
Jana Kahin Ho Chahe, Har Bar Hi Guzarna
Teri Taraf Se
Yeh Kosise Toh Honge Kam Nahi
Yeh Kosise Toh Honge Kam Nahi

[Chorus]
Nachahiye Kuch Tumse Zyada, Tum Se Kam Nahi
Jo Tum Na Ho, Rahenge Hum Nahi
Jo Tum Na Ho, Toh Hum Bhi Hum Nahi
Nachahiye Kuch Tumse Zyada, Tum Se Kam Nahi
Jo Tum Na Ho, Jo Tum Na Ho
Jo Tum Na Ho, Jo Tum Na Hoyou Might Also Likeembed"
