Track_Artists,duration_ms,id,Track_Name,Album_ID,total_tracks,Album_Name,release_date,Album_Artists,Producer,Producer_ID,_merge,Lyrics
"[{'external_urls': {'spotify': 'https://open.spotify.com/artist/1mBydYMVBECdDmMfE2sEUO'}, 'href': 'https://api.spotify.com/v1/artists/1mBydYMVBECdDmMfE2sEUO', 'id': '1mBydYMVBECdDmMfE2sEUO', 'name': 'Sachin-Jigar', 'type': 'artist', 'uri': 'spotify:artist:1mBydYMVBECdDmMfE2sEUO'}, {'external_urls': {'spotify': 'https://open.spotify.com/artist/2oSONSC9zQ4UonDKnLqksx'}, 'href': 'https://api.spotify.com/v1/artists/2oSONSC9zQ4UonDKnLqksx', 'id': '2oSONSC9zQ4UonDKnLqksx', 'name': 'Atif Aslam', 'type': 'artist', 'uri': 'spotify:artist:2oSONSC9zQ4UonDKnLqksx'}, {'external_urls': {'spotify': 'https://open.spotify.com/artist/0NErdIJtuKBjtxKmlqaWdj'}, 'href': 'https://api.spotify.com/v1/artists/0NErdIJtuKBjtxKmlqaWdj', 'id': '0NErdIJtuKBjtxKmlqaWdj', 'name': 'Divya Kumar', 'type': 'artist', 'uri': 'spotify:artist:0NErdIJtuKBjtxKmlqaWdj'}, {'external_urls': {'spotify': 'https://open.spotify.com/artist/3cqeO3muWIW5uSmUDNCmyT'}, 'href': 'https://api.spotify.com/v1/artists/3cqeO3muWIW5uSmUDNCmyT', 'id': '3cqeO3muWIW5uSmUDNCmyT', 'name': 'Rekha Bhardwaj', 'type': 'artist', 'uri': 'spotify:artist:3cqeO3muWIW5uSmUDNCmyT'}, {'external_urls': {'spotify': 'https://open.spotify.com/artist/4YRxDV8wJFPHPTeXepOstw'}, 'href': 'https://api.spotify.com/v1/artists/4YRxDV8wJFPHPTeXepOstw', 'id': '4YRxDV8wJFPHPTeXepOstw', 'name': 'Arijit Singh', 'type': 'artist', 'uri': 'spotify:artist:4YRxDV8wJFPHPTeXepOstw'}]",169090,01Lut8W3laY1TODkn7eCPq,Badlapur Mashup,4ahg47diWPOQ6d6C8e6PHI,8,Badlapur ,2014-12-09,"[{'external_urls': {'spotify': 'https://open.spotify.com/artist/1mBydYMVBECdDmMfE2sEUO'}, 'href': 'https://api.spotify.com/v1/artists/1mBydYMVBECdDmMfE2sEUO', 'id': '1mBydYMVBECdDmMfE2sEUO', 'name': 'Sachin-Jigar', 'type': 'artist', 'uri': 'spotify:artist:1mBydYMVBECdDmMfE2sEUO'}, {'external_urls': {'spotify': 'https://open.spotify.com/artist/6q29t5RuXxlBuqIZsOMQss'}, 'href': 'https://api.spotify.com/v1/artists/6q29t5RuXxlBuqIZsOMQss', 'id': '6q29t5RuXxlBuqIZsOMQss', 'name': 'Priya Saraiya', 'type': 'artist', 'uri': 'spotify:artist:6q29t5RuXxlBuqIZsOMQss'}]",Sachin-Jigar,1mBydYMVBECdDmMfE2sEUO,both,"[Couplet 1]
Ouais, Ma Vie, C'Est Le Truman Show, La Came Tombe Du Ciel Sur La Scène
Sourire Coincé À La Selle, Je Parle Pas, On Me Fait Tout À L’Œil
J'Viens En Retard Comme Si J'Tais À L'Heure, J'Pardonne Pas Comme Si J'Ai Des Valeurs
Grammaire Sur Ma Liste De Malheur, Ta Grand-Mère Qui Valide Le 20 Heures
Mais Cette Vie Est Belle, Je Le Sais, Comme Millions Euros De Recettes
Comme Des Tourtereaux Sur La Branche, Avant Qu'Le Chômage Ne Fasse Qu'Elle Ne Cède
J'Sais Qu'Il Faut Du Blé Pour Les T'Nir Ou Attendre La Prochaine Manche
Non, J'Vais Pas Pleurer Devant C'Film, J'Sais Qu'C'Est Pêcher D’Être Sensible
La Peur Nous Pousse Comme Des Infirmes, Trop D'Journalistes Qui Désinforment
Salle De Prière Désemplie, Tous Occupés À Monter Des Empires
Avant Que J'Me Désintègre, J'Vais M'Trouver, J'Vais Faire La Paix
Après, J'Vais Rouler Un Teh Et Fusionner Avec Le Canapé
Ouais, Bien Sûr Que J'Ai Tout Prévu, C'Est L'Chemin Qui Compte, Pas La Fin Qui Prévaut
Gros, Les Potos Avant Les Putes, J'Vais Sauver Les Hommes Avant Les Veaux
J'Vais Sauver Les Miens Avant Les Vôtres, Gros, Sinon, C'Est Pas La Peine
Mais Sauver Les Siens Avant Les Autres, Gros, C'Est L'Programme Des Le Pen
Ouais, Populace Manipulée, Au Profit De Qui ? Ce N'Est Pas Stipulé
Orphelins Violés, Désarticulés, Les Loisirs De La Haute Sont Particuliers
Viens Voir La Vie Qu'On Peut Pas Diffuser, T'Sais ? Celle Qu'Est Acidulée
Là Où Le Shit Et Le Smic, C'Est Le Max', Au-D'Ssus, L'Esclave Serait Moins Stimulé
Ouais, Je Sais Comment Ça Se Passe, Un Joint, Comment Ça Se Tasse
Une Tchoin, Comment Ça Se Masse, Un Cul, Comment Ça Se Casse
Donc Je Sais Pourquoi Elle Veut Qu'Je Repasse, Pourquoi Elle Veut Qu'On L'Refasse
Pourquoi Elle Veut Qu'On Ressasse (Quoi), Même Une Minute Dans Le Sas
Ouais, Le Sexe Et L'Argent, Ça Fait Tout, J'Ai Les Deux Et Pourtant, Ça Fait Rien
Ne Respire Pas Mon Air, Ça M'Étouffe, J'Veux Être Libre, Le Reste, J'M'En Bats Les Reins
Ouais, J'Veux Être Ivre, Demain Ne Compte Pas, Pourquoi La Vie Devrait Être Un Combat ?
Hein ? Gros, J'Esquive L'Œil Et L'Compas, Ainsi Qu'Les Soldats Qu'La Machine Dompta
Ouais, J'Conjugue Au Passé Simple, Passe-Moi L'Feu, La Lumière Va S'Éteindre
J'Tendrai Jamais La Patte À Ces Chiens, Pour L'Moment, On S'En Sort Assez Bien
Verre À Moutarde Rempli D'Eau, J'Prends La Pilule Rouge Comme Un Antibio'
Je Vais M'Asseoir En Lotus Au Tibet Et Me Coiffer Comme Les Reufs En Chimio'
Les Élites Sont Des Satanistes, De Sombres Sorciers Maîtrisant La Magie
Les Créateurs Et Gardiens D'La Matrice, À Chaque Poste De Pouvoir, Quelqu'Un D'La Famille
C'Est Bon Pour L'Bénéf' Si C'Est La Panique, C'Est Bon Pour L'Bénéf' Si C'Est La Famine
C'Est Bon Pour L'Bénéf' De Ruiner L'Afrique, C'Est Bon Pour L'Bénéf' D'Asservir L'Asie
Ouais, Ce Monde Est Cruel À Souhait, Les Mentalités Sont Baisées As Fuck
J'Vais Nous Venger, Les Baiser I Swear, Même Si Le Mal Par Le Mal, C'Est Pas Top
Ou Bien J'Oublie Tout Et J'Ouvre Mon Laptop, J'Fais Navig' Privée, Je Fais ""Gangbang Hardcore""
Là, J'Me Branle À Mort En Attendant La Mort, Devant L'Amour De Ceux Qui N'Font Qu'Un Corps
You Might Also Like[Pont 1]
Ce Monde Est Cruel, Ce Monde Est Cruel
Ce Monde Est Cruel, Ce Monde Est Cruel
Ce Monde Est Cruel

[Couplet 2]
Que Braquer Non-Stop (Braquer Non-Stop), Que Braquer Non-Stop (Braquer Non-Stop)
Que Braquer Non-Stop (Non-Stop, Non-Stop), Que Braquer Non-Stop (Non-Stop, Non-Stop)
Motherfuck, J'Suis Dans L'Top, Que Niquer Des Daronnes
Kool Shen, Joeystarr, Fuck Jouer Les Stars
Que Braquer Non-Stop (Braquer Non-Stop), Que Braquer Non-Stop (Braquer Non-Stop)
Que Braquer Non-Stop (Non-Stop, Non-Stop), Que Braquer Non-Stop (Non-Stop, Non-Stop)
Motherfuck, J'Suis Dans L'Top (Motherfuck, J'Suis Dans Le Top), Que Niquer Des Daronnes
Kool Shen, Joeystarr, Fuck Jouer Les Stars
Fuck Jouer Les Stars (Hey Hey Hey Hey), Y'A Pas Qu'Moi Sur L'Estrade (Nan Nan Nan Nan)
Suikon Fait Les Backs (Suik'On Fait Les Backs), Bientôt La Mixtape (Bientôt La Mixtape)
Motherfuck, Motherfuck, Motherfuck, Motherfuck
On Remplit Des Stades (Okay), Fuck, J'En Veux Encore
La Chatte, Je M'En Moque (La Chatte, Je M'En Moque), Motherfuck, J'Suis Dans L'Top (Motherfuck, J'Suis Dans L'Top)
J'Ai Refait Des Stocks, Okay (Okay), On R'Vient Sur Les Squats (Hin Hin Hin Hin)
Turn Up, Une Entorse (Aïe Aïe Aïe Aïe), Un Grand Pied Dans Le Torse (Aïe Aïe Aïe Aïe)
Tout Ken, J'Fais En Sorte (Tout Ken, Tout Ken), Fuck, J'Arrive En Force (Fuck, J'Arrive En Force)
Conso' Dans Les Socks (Conso' Dans Les Socks), Mon Seul Médoc' (Mon Seul Ouh)
Fuck L'Avis Du Doc' (Fuck L'Avis Du Doc'), Plus De Flow Qu'Aux Docks
Motherfuck, J'Suis Instable Mais J'Te Tape Même Pas Sur Insta'
Motherfuck, Je M'Installe (Hey Hey Hey Hey), Motherfuck, J'Suis Dans L'Top (Motherfuck)
Que Braquer Non-Stop (Braquer Non-Stop), Que Braquer Non-Stop (Braquer Non-Stop)
Que Braquer Non-Stop (Non-Stop, Non-Stop), Que Braquer Non-Stop (Non-Stop, Non-Stop)
Motherfuck, J'Suis Dans L'Top (Motherfuck, J'Suis Dans L'Top), Que Niquer Des Daronnes (Oye, Oye, Oye)
Kool Shen, Joeystarr (Hey Hey Hey Hey), Fuck Jouer Les Stars (Hey Hey Hey Hey)
[Couplet 3]
Bénéfice, Gang-Gang, Bénéfice
Première Pensée : Toujours Primitive ; Générer Du Bif', C'Est Pas Difficile
Jour De Paie, Danse Comme Billie Jean, Hey, Hey, Plaisir Illicite
Timide, J'Deviens Émotif, J'Regarde Le Ciel, Ses Motifs, Hey
À Chaque Instant C'Est Possible, Mais À Chaque Instant, L'Emoji Pleure
Que D'La Violence Sur L'Moniteur, Ça Touche Les Gosses Comme Les Moniteurs
L'Argent, Ça Démolit L'Cœur ; Quand Ça Manque, Ça Démolit L'Cul
Suce Pas Pour Plus De Pécules, Chie Pas Dans Mes Bottes, Y'A Plus De Pq, Merde
Primitif, Putain C'Que J'Suis Primitif
Mort-Vivant Comme Lady Di, J'Vais Faire L'Milliard, Comme P. Diddy
Y'A Qu'Les Nuages Qui Limitent, J'Fais Gaffe, Y'A Des Gosses Qui M'Imitent
Enfoiré, T'Es Si Fini, Tu Mérites La Syphilis
Parle Pas D'Maléfice Lorsque T'As Merdé, Lorsque L'Mal Est Fait
Wesh Le Tavernier, J'Vais Prendre La Leffe Jusqu'À M'Flinguer La Vessie
Arrêtez Les Larmes, C'Est Pathétique, Arrêtez D'Vivre Dans Une Tragédie
Visez Autre Chose Que Les Assedics Avec La Conso' Dans Les Atemi
J'Doggin' Synthétique Pute En Jogging Synthétique, Ouais
Produit Synthétique, Faux Cils Synthétiques, Tout De Synthétique Sauf Mon Profil Atypique
Qu'Importe Le Cas, Je Suis Pacifique, Suis-Je Le Seul Érudit Du Carré Vip ?
J'Vois Des Rubis Quand On S'Affilie Et Le Continent Mu Dans L'Pacifique, Wow
Ton Cavu Tourne Comme Un Handspinner, J'Écris Mon Destin Sans Ghostwriter
Ça Bouchonne Au Drive Quand La Dope Circule, Je Crache La Fumée, Ça Fait Des Crop Circles (Ouh, Ouh)
C'Est Quoi, C'Monde Qu'On Laisse À Nos P'Tites Sœurs ? Une Grosse Bite Sur Un Post-It
Et Détournements D'Fonds Dans Les Gros Titres ? Nan
J'Suis D'La Nouvelle Civilisation, Tu Vas Finir À La Rue, C'Est La Meilleure Intimidation
T'En Oublierais Ton Élévation Mais Fuck Cette Merde, Je Vais Bosser Sec Bien Avant Mes Trente-Sept Piges
Je Sois Proche Des Maîtres Avec Une Breitling, Je N'Répète Que La Prophétie
Primitif, J'Suis Encore Trop Primitif
Sur Tes Amigos, J'Pisse Comme Un Vrai Parigot
Vodka-Paquito Pour Pas Niquer Ces Clowns Échappés Du Chapiteau
Glober Des Yeux Comme Stabilo, Ça Gobe Des Queues Comme Haribo
J'Maîtrise La Chimie Ainsi Qu'L'Alchimie, J'Suis Dans L'Sashimi
Suffit Qu'Je Pense À Ta Minch Et Ça Y Est, Vers Moi Ta Minch Achemine
J'Tacle À La Gorge, Pas À La Cheville, J'Retourne Ni Ma Veste Ni Ma Chemise
J'Peux Pas Lâcher Tant Qu'J'Suis Pas Che-Ri, Je Cours Après L'Temps, Je Marche Vite (Wow)
J'Veux M'Envoler, Là, Je Vibre Bas, Je N'En Veux À Personne, C'Est Moi Qui M'Retarde
Soit Je Fais L'Million Et J'Me Tire De Là, Soit C'Est La Cia Qui Me Criblera
J'Écris Ce Rap Comme Un Cri De Rage, Ça Sent La Guerre Dès La Prise De Voix
D'T'Façon, Même Quand J'Veux Donner D'L'Amour, Elle Est Prise De Spasmes (Spasmes, Spasmes)
[Couplet 4]
J'Aimerais Tant Faire La Paix Avec Toi, Avec Moi
Ouais Mais Nan, Ma Bête Noire Me Laisse Pas Assez D'Espace
Je Suis Toi, Tu Es Moi, Je Sors Même De Ta Mère
On Sort De La Même Merde Et Pourtant, Tu M'Agresses
J'Vais T'Faire Fondre La Graisse, Je Vais Found Ton Adresse
Te Montrer Mon Adresse Quand Je Chante La Messe
On Dira Dans La Presse Que C'Est À Cause De La Hess
Qu'On Était Des Sauvages, Des Otages Du Naufrage
Des Ados Sans Repère, Des Adultes Trop Amers
On M'Adule, C'Est La Fête, J'Les Insulte, C'Est La Merde
On M'A Pris Pour Un Clown, On M'A Pris Pour Un Fou
Pour Info' : J'Fais Des Sous Plus Que Toi, Ma Nympho
Licence De Maths-Info M'Sert À Rien, Je Travaille Pas
J'Reste Tranquille, Je Racaille Pas, J'Reste Sous L'Drap, Comme Kkk
Quand J'Me Lève, J'Veux Les Uer-T, J'Veux Les Ken Dans La Ruelle
Fuck Un Duel, J'Vais Leur Chier D'Ssus Comme Une Mouette
J'Vais Les Shlasser Au Moët, Exploser Sur Le Bar, J'Tire Une Barre
Et Souris, J'Ai L'Cœur Noir Et Pourri, J'Aime Le Soir
Y'A Moins D'Monde, Y'A Ma Beuh, Y'A Ma Blonde, Y'A Ma Queue
Y'A Ma Blonde, C'Est Vald Qu'A La Bombe, Bom-Bom-Bomb
Bah Voyons, T'As Pas D'Chance : T'Es Pas Beau, T'As Pas D'Argent
T'Es En Chien, T'Es Navrant, Donc T'Agis Comme Fils De Pute
J'Espère Que Tu Pries Jésus Quand L'Maton Te Brise Le Cul
Sur Ta Tombe, Je Pisse Dessus, Croque-Mort Demande Qui Es-Tu
J'Ai Le Seum, J'Apprends À L'Assouvir, Commence Vite
À Courir, À Ton S'Cours, Personne Va Accourir
J'Aimerais Tant Faire La Paix Avec Toi, Avec Moi
Ouais Mais Nan, Ma Bête Noire Me Laisse Pas Assez D'Espace
Je Suis Toi, Tu Es Moi, Je Sors Même De Ta Mère
On Sort De La Même Merde Et, Pourtant, Tu M'Agresses
J'Vais T'Faire Fondre La Graisse, Je Vais Found Ton Adresse
Te Montrer Mon Adresse Quand Je Chante La Messe
On Dira Dans La Presse Que C'Est À Cause De La Hess
Qu'On Était Des Sauvages, Des Otages Du Naufrage

[Couplet 5]
Gaffez Quand Je Suis Possédé (Hey), Gaffez Quand Je Suis Possédé (Hey)
Gaffez Quand Je Suis Possédé (Hey), Gaffez Quand Je Suis Possédé
Défoncé Comme Odb (Hey), Synthèse Dans L'Ocb (Hey)
Le Mélange A Opéré (Hey), J'Connais Tous Les Procédés
Pas De Rapport Protégé (Jamais), Pour T'Faire La Fête, Faut Des G (Wow)
Ton Mélange Est Trop Léger, Tu M'As Pris Pour Un Gros Pédé
Dans La Rue Ou Au Qg, Le Sourire Est Lié Au Budget
Le Malin Vient D'Me Posséder ; Au Moyen-Âge J'S'Rais Au Bûcher
J'Fais Même Pas De Rimes Parfaites ; Dans Les Chiottes Je Pisse Par Terre
J'Te Connais Pas Nique Ta Mère ; Des Molécules Vident Ma Tête
J'Ai R'Trouvé L'Spliff De La Veille, J'Ai R'Trouvé L'String De La Vieille
Ouais J'M'En Rappelle, Elle M'Cassait Les Couilles, Pour Que J'Lui Brise La Schnek
J'Peux Faire Le Tour De La Terre, Juste Là Au Bout De Ma Tige
J'Ai D'Quoi Faire Mal Aux Ratiches, Ché-Ca Dans L'Double De La Veste
J'Ai Sifflé Toute La 'Teille, J'Appelle Mon Frérot ""Mi Amor""
Fais Gaffe À Qui T'Ouvre La Porte, On Est Venu Foutre La Merde
Gaffez Quand Je Suis Possédé (Hey), Gaffez Quand Je Suis Possédé (Hey)
Gaffez Quand Je Suis Possédé (Hey), Gaffez Quand Je Suis Possédé
Défoncé Comme Odb (Hey), Synthèse Dans L'Ocb (Hey)
Le Mélange A Opéré (Hey), J'Connais Tous Les Procédés

[Couplet 6]
J'Suis L'Produit D'Mon Environnement, Comme Mac Tyer
J'Suis En Colère Si Les Juges Environnantes N'Portent Pas D'Tailleurs
Assis En Tailleur, J'Pense Aux Aïeux, D'Ailleurs, Faut Mailler
J'Me Suis Pas Réincarné Pour Bouillave À Pattaya, Bo-Bomayé
Tu T'Es Soumis Pour Grailler, Pov' Gougnafier
Heureusement Qu'T'Es Pour La Paix, T'Es Doux Comme Une Couille Rasée
J'Fais Ma Ronde Comme Le Renard Dans Le Poulailler
Les Tours Immondes Bloqueront Les Balles Si, Un Jour, Tu Veux Défourailler
Que L'Amour Sur Les Potos, Que La Mouille Sur Les Photos, Le Cœur Est Noir Sous Les Projo'
Je Vois La Vie Comme Un Gothique, Tous Ces Rappeurs Anecdotiques
Le Viseur Est Dans Mon Optique, Aucune Maîtrise Du Low Kick
80 Zetrei, 80 Zetrei, 80 Zetrei
80 Zetrei, 80 Zetrei, 80 Zetrei
Flaques De Pisse, Flaques De Larmes, Flaques De Pétrole, Fais Comme Vald
Vald Nie, Vald S'Arme, Vald Déflore, Et Ces Pétasses
Laissent Des Flaques Sur La Toile Du Siège Baquet, Saletés D'Flics
Laissent Des Flaques Quand Ils Frappent À La Porte
Sullyvan Palpe Comme À La Morgue, Mon Poing Dans L'Cul, Comme Panacloc
Tu Vas Vivre Le Coma D'Abord, Pas D'Commun Accord
Ma, Ma Commune Hardcore A Connu La Mort
Ma Voix Dans L'Modulateur, Ma Bite Dans Coquine À Fleur De Peau
Mon Blaze Sur Akinator, Tout L'Monde Est Là Genre :
""À Qui La Faute ?"", C'Est Qu'Y'En A Qui Le Font, Et Toi Qui Le F'Rais
Retourne Rager Sur C'Qu'A Acquis Le Frère Avec Ton Paki De Merde
Loin Devant, Genre Des Kilomètres, J'Papillonne

[Pont 2]
J'Arrive Propre Comme Une Saloperie, Vrai Comme Une Cachotterie
Dis Pas ""Je T'Aime"" Comme Une Calomnie
J'M'Attends Pas Au Pire, J'M'Attends À Être Riche, Genre Maçonnique
Fais Pas L'Ouf, T'Esquives Pas Les ""Ich""
J'Suis Dans L'Four, Lâchez-Moi Les Miches
J'Attire La Fouffe Comme Chanteur R'N'B'
Si J'Reste En Bas, C'Est Une Tragédie
Hey, Oh, Hey, Oh
Si J'T'Ai Fait Du Mal, J'Suis Déso'
Hey, Oh, Hey, Oh
Ma Bite Rentre Dans Sa Tête Comme ""Réseaux""
Ce Monde Est Très Très Très Cruel, Très Très Très Cruel

[Couplet 7]
La Vie A Fait, La Vie A Fait
J'Agis Pour Mon Futur, Pour Mes Beignets D'Calamar
Quelques Points D'Sutures Cachés Sous Ma Carapace
Aucun Suce-Pute Parmi Mes Camarades
Arrêter Les Cours, C'Est Pas Une Bonne Idée (Vraiment Pas)
Tout L'Monde Te L'Avait Dit, Mais T'As Commis Des Crimes
Bim, Dans Sa Chatte Tout L'Holiday
Plus Violent Qu'Manifestants Contre Policiers
J'Sais Tellement D'Trucs Qu'On Dirait Qu'Je Marche Broliqué
Tout C'Profit Fait, Faudrait Qu'Je Pense À Profiter
Faut Qu'J'Reprenne Le Shit, Là, J'Ai Bien Trop D'Idées
Dieu Merci, J'Suis Né Pour Dominer, Pas Ken Les Chattes Qui Ressemblent À Grosminet
Mer Apaisée Que Dans L'Coquillage
Mère À Baiser Donc Pas L'Temps Pour L'Copinage
J'Ai Trop Bédave, Là, J'Ressemble À Gorillaz
Message De Nikita Du Compte Official
J'Passe Le Relais, J'Dis À Mon Fils De Pas Pleurer
Regarder L'Sheitan Œuvrer, D'Apprendre À Manœuvrer
Quand Je Râle, Il M'Dégaine La Grimace De La Levrette
Plus Caille-Ra Qu'Un Pirate De Gare De L'Est
J'Inhale Que D'La Beu-Her, J'Débarque En Guadeloupe, Timal C'Est Moi L'Gwer'
Fuck Lignac, J'Ai La Recette, Comme Ak-4-7, J'Suis Génial Même À L'Ouest
J'Me Connais Bien, J'Suis Pas Un Psychopathe
C'Est Eux Qui Vont Tuer Des Gens Pour Ceux Qu'Ils Idolâtrent
Prétentieux Comme Nicolas, Grosse Haleine, Pas D'Ricola
J'Écoute Quand Son Clito' Parle, C'Est Jamais D'La Rigolade
Hey, J'Me Connais Bien, J'Suis Pas Un Psychopathe
C'Est Eux Qui Vont Tuer Des Gens Pour Ceux Qu'Ils Idolâtrent
Prétentieux Comme Nicolas, Grosse Haleine, Pas D'Ricola
J'Écoute Quand Son Clito' Parle, C'Est Jamais D'La Rigolade
C'Est Jamais D'La Rigolade, C'Est Pas Des Lol Sur Skyrock

[Couplet 8]
J’Recherche Un Permis Port D’Arme
Pour Pouvoir Continuer D’Être V.A.L.D. Hors Cam'
J’Ai La Fève Et L’Orgasme, C’Est La Fête Et J’Cause Pas
J’Ôte Ma Délabrée D’Basket Et Je Drogba Tes Ratiches
Poto, C’Est L’Affiche D’Être À Mi-Ch’Min
D’Me Mâcher La Pine Pour Gratter Ma Pouche
Pour Rapper, Ma Bouche Fait Des Bruits D’Seins Qui S’Entrechoquent
Et J’Échoue Jamais Si La Choupinette M’A Trouvé Chou
Souvent, J’Retrouve Des Shootes Échoués Sous Mes Shoes
Jouer Les Troubadours N’Est Pas Dans Mes Souhaits, Je Fous Que Des Coups
Oui, Je Dickslap, Dickslap, J’Fais Gaffe À C’Qui S’Trame
Juste Derrière Mon Eastpak, Rejoins-Moi Ou L'Islam
C’Est Vrai Qu’Éméché J’Ai Péché Mais J'Ai Jamais Prêché Sur Les Quais Du Tgv, C’Est Ça D’Moins Sur Mon Cv
V.A.L.D.T.C Aka L’Pcp En Ddp, Le Pet Précédé D’Un Wack Mc Décédé
Décidément, J’Ai La Pêche Comme Ma Pression Préférée
Pour Flamber Ta Paie, Nique La Dépression, J’Ai La
Tête À L’Envers, Sa Schneck À L'Envers, Le Haut Vers Le Bas
Je Veux Faire D’L’Euro Tout En Restant Fier De Moi
Exactement, Triche Aux Exams, J’Ai Jamais Pris D’Ecsta', J’Ai Peur Que Ça M’Plaise, Ça
Bestial Comme Ta Saloperie De Caisse Braquée
C’Est Fou C’Que L’Homme Peut Faire Pour S’Acheter Un G-Star, N’Est-Ce Pas ?
Sullyvan Surine À Vue, Oui, J’Urine Aussi Sur Ton Posse
Nique La Survie De Ta Musique (De Ta Musique)
Nqnt, T’Es Plus, T’Es Dead, J’T’Ai Vu Lécher Pour Un Écu, C’Est Gay
J’Ai Plus D’Respect Pour La
Oui, J’Pénètre Tout C’Qui Bouge, Louche C’Qu’On Trouve
Derrière Des Bouts D’Tissus : Des Gens Qui Souffrent, Des Jambes Qui S’Ouvrent Avec Des Grandes Pilules
J’Remplis Tout, J’Fais D’Mon Mieux, Mieux, C’Est Mieux Que Bien Et L’Bien, Hé Bien, Le Bien N’Existe Que Peu
J’Pige Le Jeu, Je Trime, Je Veux Être Riche Gueux
Mon Style Fait La Dif’, Qu’Il Arrondisse Mes Fins D’Mois, Ce P'Tit Fils De (Fils De)

[Couplet 9]
J'Suis Dans La Street Comme Dans Galeries
Monstre Dans Ton Cavu, Non, C'Est Pas Halloween
Fonce Hors Du Battlefield, Plonge Pas Dans Relation Platonique
Non, Non, Ne Saoûle Pas Le Diss, Ronge-Moi Les Calories
Weed Et Synthèses Pour Mon Catering
Ça Fait Des Mois Qu'Je N’Ai Pas De Rimes
Non, J’Devrais Pas Le Dire, Ton Dieu Va M'Mettre Des Baffes Vengeresses
Mais, Nique Sa Mère, Il N’Est Pas Là, Même Quand Je Reste
Demande Au Ciel La Recette Pour Faire Tant De Pèze
La Recette Pour Faire Jouir Sans Même Un ""Je T'Aime""
C'Est Malheureux, J'Suis Jamais L'Même À Part Quand Je Baise
J’Suis Malheureux, Je Sais Qu’Elle M’Aime Même Quand Je Tej
J'Assure L’Spectacle Comme Walt Disney Ou La Blanche Neige
J’Espère L'O.D. Ou L'Million Avant D’Être Trentenaire
Ton Crew : C'Est Des P'Tites Putes Et Des Grandes Merdes
J’Veux Plus Vous Voir, J’Vais M'Recueillir Devant Champ De Zeb
Salope, Tu Pars Sans Repères ; Salope, Tu Parles Sans Le Faire
Salope, Tu Masques Ton Reflet ; Salope, Tu Casses Ton Re-Frè
Salope, Pour Toi, C'Est L'Enfer ; Salope, Cette Fois, C'Est La Der'
Salope, Pour Toi, Trop De Traits ; Salope, Pour Toi, Pas De Trêve
Salope, C'Est L'Heure Du Hlib Et J'Suis Pour L'Amour
J'Ai Neuf Pussy, Pas Neuf Fusils Qui Me Font La Cour
""Quoi D'Neuf Sully ?"" A.K.A. La Mort Subite
La Morsure Digne D'Un Piranha, Destin Sublime Comme Rihanna
En Une Seule Rime, Je Peux T'Irradier
Mon Gros, J'Urine Sur Le Pied-Zer Du Brigadier
Moi, J'Suis Gentil, Faut Pas Diffamer, Sinon, Ton Trou D'Balle, On Peut Dilater
Mon Cœur S'Fait Pas Pirater, On N'Arrête Pas Frère, On Continue Avec Moins D'Amis

[Couplet 10]
J'Suis Là Dans La Foule, Jamais Sans Amour
Comme J'Ai Plus D'Un Tour, Toutes Ces Putains Courent
Tellement D'Flow Alors Que J'Ai Juste Bu Un Coup
J'Bé-Flam Trop, J'Dépose Que Du Violet Sur Un Boule
J'Bé-Flam Trop, J'Ai Le Démon, J'En Prends Trop, J'Fais Deux Tées-Mon
En Même Temps, J'Suis Dans Deux Des Mondes, La Tête Entre Deux Tétons
Toujours Un Œil Sur Les Comptes, Toujours Une Main Sur Les Couilles
Les Vrais Res-Frès, On Les Compte Et Les Autres Comptent Mes Couilles
Plus De Selfie, Plus De Temps, J'Peux Pas Rouiller Sur Le Banc
Quand J'Sais Pas, J'Dis ""Sûrement"", Donc Ton Macron Sûr Ment
T'Es Comme Van Damme Sur Le Ring, Tu Fais L'Grand Écart Sur Demande
J'Aime Ça, Que Tu Sois Soumis, J'Aime Ça, Qu'Tu Sois Sur Le Ventre
Plus De Sourires, Plus De Ventes, Plus De Groupies, Plus De Champ'
Plus De Goupilles, Plus De Tanks, Plus De Roupies, Plus De Sang
J'En Veux Pas Trop, Justement, Tu Peux M'Sucer Juste Le Gland
Instinctivement, J'Brûle Le Chanvre, Ça Étouffe Les Hurlements
Des Experts En Magie Noire Essaient D'Arrêter Mes Balles
J'Trouve Tout À O'Parinor, Nique Sa Mère Châtelet-Les Halles
Gros, J'Ai Péta Ton Briquet Pour Ter-Cla Un Céréale
Si Ta Vie Est Compliquée, C'Est Qu'Une Putain Cérébrale
Nique Sa Grand-Mère Le Score, Tant Qu'J'Fais Plus, Ça M'Est Égal
Nique Sa Grand-Mère Le Sport, Tant Qu'J'Les Baise Et Qu'J'Les Régale
Nique Ta Grand-Mère De Force Si Tu Jactes Comme Une Pédale
Jamais L'Bon Nombre De Pétales, Toujours L'Bon Nombre De Pétards

[Couplet 11]
J'Ai Dit : ""J'Vais Faire Du Rap"", J'Étais Un Baisé Dans Ma Tête
V.A.L.D Comme Un Gramme De Md Dans La Fête
Jamais J'Me Casse Les Couilles, J'Mange Même Le Poisson Sans Arête
On A Les Mains Sales Ainsi Que Les Doigts Dans La Schnek
J'Suis Pas Monocentré, J'Aime Le Shit Et La Weed
Belek À Ton Dessin, Sorti D'Pictionary
J'Ai D'Nouveaux Habits Et Plein D'Nouveaux Amis
Donc J'Fais Un Nouveau Pli, J'Ai Pas D'Nouveau Hobby
J'Connais D'Jà L'Avenir, J'L'Ai Vu Dans L’Œil Du Manager
Interpol Nous Recherche, On N'Est Pas Braqueur Amateur
Viens Donc À Ma Table Si Tu Flex Comme Un Gallagher
Dis : ""Bonjour"" À Ma Eue-Qu Et ""Adieu"" À La Gare
L'Histoire Est Écrite Et Se Réécrit À Chaque Seconde
Regarde Ces Fils De Pute, Ça S'Voit Tout D'Suite Qu'J'Suis Pas D'Ce Monde
Non, J'Baisse Pas Les Yeux, J'Baisse Pas Mon Froc, J'Baisse Pas D'Un Ton
Je Monte Dans Les Tops Et Sur Ta Mère Le Canasson
Non, Fais Pas La Pute, Fais Pas La Gueule, Sois Pas Mauvais
Fais Pas... D'Où Tu Viens, Va Pas T'Sauver
J'Sais Pas Si T'Es Malhonnête
J'Entends L'Diable Me Talonner
J'Encule Le Vhr ; Avant L'Show, J'Suis Ballonné
J'Me Branlais Dans Ma Chambre, Là, J'Ai L'Million D'Abonnés
Même Bourré Au Volant, Suiki M'Empêche De Cartonner
Ient-Cli Arrive De Tout-Par, Heureusement J'Sais Slalomer
Regarde La Kichta Qu'J'Envoie, Sérieusement Garde La Monnaie
Regarde La Kichta Qu'J'Envoie, Sérieusement Garde La Monnaie
J'Ai Pas L'Temps De Tous Les Tuer, Faut Qu'J’Apprenne À Pardonner
Passe-Moi Du Feu Que J'M'Éteigne
V.A.L.D, Que Des Beignes
Double Platine, Le Prequel
Double Platine, Le Prequel
No Tube Zone, No Tube Zone
No Tube Zone, No Tube Zone

[Couplet 12]
Je N'Suis Pas Un Écrivain, Je Suis Plus Qu'Un Esprit Simple
Je Multiplie Les P'Tits Pains, Je N'L'Appelle Pas, J'Sais Qu'Il Vient
On M'Appelle ""V.A.L.D."" ; C'Rap De Merde, J'L'Ai Allaité
J'Crois Qu'J'Vais Jamais Arrêter, J'Coupe La Plaquette À L'Épée
Plein De Filtres, Plein D'Effets, T'As Pas D'Rime, Pas De Texte
Pas De String, Même Pas De Fesses, Pas De Peace, Donc Pas De Guerre
Si Tu L'Fais Pas, Moi, Je L'Fais ; Si Tu L'Sais Pas, Moi, Je L'Sais
Comme Si J'Étais Sorti D'H.E.C., Sur L'Détecteur, La Chaussette
J'Ai Les Combos, La Recette, Promis, J'Touche Pas Ta Sœurette
Je T'Aime Encore En Levrette, Je T'Aime Encore En Secret
Putain, J'Ai L'Cœur Sur La Main, J'Renifle Les Fleurs Du Malin
J'Sens Encore L'Odeur Du Machin, J'Esquive Lueur Du Matin
Je Sais Très Bien C'Qui M'Attend, Elle M'Dit : ''Pense À Moi Si T'As L'Temps''
J'La Vois Qu'Une Seule Fois Par An Comme Le Prime Sur Le Sidaction
J'Ai La Vue Sur L'Timent-Bâ, Je N'Suis Plus Sentimental
Tu M'As Vu Sortir En Bas, Les Poumons Quasiment Noirs
En Route Pour Niquer Des Mères Comme Lundi Matin, Dimanche Soir
M'Écoute Pas Si Tu Préfères Ton Rap De Caissier Qui Vend Pas
Nqnt Péritel, Sullyvan Rappe Trop Spirituel
Je Ne Ter-Fri Plus Everyday, Ç'Me Rend L'Esprit Trop Étriqué
Niquez Vos Mères, J'Vais M'Délivrer ; Tout Cette Oseille, J'L'Ai Mérité
J'Ai Disque D'Or, J'Ai Pedigree, T'As Que Le Mort, T'Es Périmé
J'Peux M'Arrêter Mais J'Continue, Pour Le Turn-Up, Je Contribue
Abandonne-Moi, J'Reconfigure, J'Te Laisse La Chatte En Confiture
J'Peux M'Arrêter Mais J'Continue, Pour Le Turn-Up, Je Contribue
J'Ai La Vue Sur L'Timent-Bâ, Je N'Suis Plus Sentimental
Tu M'As Vu Sortir En Bas, Les Poumons Quasiment Noirs
En Route Pour Niquer Des Mères Comme Lundi Matin, Dimanche Soir
M'Écoute Pas Si Tu Préfères Ton Rap De Caissier Qui Vend Pas

[Couplet 13]
De Quoi Tu Parles ? De Quoi Tu Parles ? Le Savoir Est Dans L'Silence
T'Es À Poil, T'Es Sans Finance, T'Es Ma Proie, T'Es Ma Pitance
Y'A Moi Qui Jette Les Billets Et Puis Il Y A Toi Qui Danse
Y'A Pas De Coïncidence, Ferme Ta Gueule C'Est Moi Qui Pense
J'Comprends Ton Besoin D'Exister, Mais Quand Tu L'Ouvres C'Est Moche
Comprends Notre Besoin D'T'Exciser ; Ton Français Il Fout Les Pétoches
Reste Tranquille Mains Dans Les Poches ; Tu Jactes Ne Dis Pas Qu'C'Est L'Teush
T'Es Vraiment Du-Per, C'Pas Du Bluff ; Est-Ce Vraiment Du Sperme Ou Du Blush ? Blush
Pour Toi Pas D'Rédemption
J'Vais T'Enfler Les Ganglions, Tout Ça Sans Prétention
Bâtard Si T'Es Dans L'Sillon, Je Peux Dévier D'Ma Mission
Toujours La Même Ambition Depuis Post-Bac Admission
Quand J'Rappe Je Sais Qu'J'M'Abrutis ; Ma Bite Dans Ta Bouche Balbutie
Je L'Fais Pas Pour Les ""M'As-Tu Dit"", Nan, Mais Pour Le Salaire D'Matuidi (Charo)
De Quoi Tu Parles ? De Quoi Tu Parles ? Le Savoir Est Dans L'Silence
T'Es À Poil, T'Es Sans Finance, T'Es Ma Proie, T'Es Ma Pitance
Y'A Moi Qui Jette Les Billets Et Puis Il Y A Toi Qui Danse
Ferme Ta Gueule C'Est Moi Qui Pense, Y'A Pas De Coïncidence
De Quoi Tu Parles ? De Quoi Tu Parles ? Le Savoir Est Dans L'Silence
T'Es À Poil, T'Es Sans Finance, T'Es Ma Proie, T'Es Ma Pitance
Y'A Moi Qui Jette Les Billets Et Puis Il Y A Toi Qui Danse
Y'A Pas De Coïncidence, Ferme Ta Grande Gueule

[Pont 3]
Tout C'Que J'Aime Dans La Vie, C'Est Baiser Et Fumer Du Shit
Fumer Du Shit, Fumer Du Shit, Fumer Du Shit
Tout C'Que J'Aime Dans La Vie, C'Est Baiser Et Fumer Du Shit
Fumer Du Shit

[Couplet 14]
Tout C'Que J'Aime Dans La Vie, C'Est Baiser Et Fumer Du Shit
V.A.L.D, C'Est Un Mystère, Il Faudrait Que Tu L'Élucides
Sucer Du Chibre, Ça Peut Rapporter De L'Oseille, J'Sirote Grey Goose
Vous, Vous Buvez Du Pif, J'Viens Avec Un Mouchoir Au Cas Où Vous Saignez Du Pif
D'T'Façons, Vous Différenciez Pas Le Perrier Du Cidre
J'Fais Qu'M'Entraîner Ici, J'Fais Qu'M'Entraîner Ici
J'Ouvre La F'Nêtre, Je N'Fais Que Humer Du Vice
Je Jette Ma Clé Usb Dans Les Chiottes Pour Buter Lucy, L'Amour Est Mort
Ouais, Ferme Ta Gueule, Arrête De T'Prendre Pour Une Érudit, Tu Es Stupide
Leur Vision Est Trop Étroite, Est-C'Que T'As Vu Mes Pupilles ? Eh
J'Pense À Tout L'Monde, J'Ai L'Cœur Ge-Lar, Ouais
J'Mets Pas De Margiela Nan ; Platine, J'Vais Marger Là, Ouais
Je Suis Où Personne N'A Marché, Là
J'Ai Qu'À T'Voir, Je Dis : ""Nah Sheitan"", Faut Pas Qu'J'Boive, J'Vais Faire Le Sheitan
Toujours Dans L'Vrai Quand J'Dis : ""Ah, J'Sais Pas""
Nuage De Teh Quand J'Dis : ""Lâchez-Moi""
J'Ai Envie D'Zeb, Je Rentre Chez Toi

[Pont 4]
Ce Monde Est Vraiment Très Cruel, Ah C'Est Vraiment Cruel
Ce Monde Est Cruel, Vraiment Très Cruel

[Couplet 15]
Tu Ne Sais Plus Ce Qui T'Arrive, Tu La Joues Lascive, Mais La Flamme Je Ravive
Je Suis Ton Cadeau, La Vie, Ton Anniv', J'Pourrais Te Faire Rire Comme Une Ado
Je Crois En L'Avenir, Le Passé Pas Trop, Le Passé Pas Drôle
Le Pas, C'Est Pas Ma Cadence, Salope, Je Galope, Je Provoque Avalanche
Tu Croyais Pouvoir Me Tester ? Ah Bah Nan, Je Suis Dans Cette Pute Comme Kanye Dans Kardashian
J'Lui Mets Les Menottes, J'Suis Attachant, Je Sors Les Quenottes, J'Suis Pas Patient
Je Suis Le Médecin, J'Suis Pas Patient, Elle Me Bouffe Le Fruit De La Passion
Elle Me Touche, Je M'Enfuis D'Un Pas Sûr En Pantoufles, Je Suis Dans L'Patio
Tu Pourras Pas Suivre Sans Cardio, J'Écris Des Images Comme Sur Les Murs De Lascaux
Leur Vision Est Trop Étroite, Dans La Vie, J'Ai Trempé L'Doigt
Au Grand Journal En Trump Et Toi ? La Tronche Est Pâle, La Trompe Est Moite
Trophée, Trophée
J'Leurs Mets Des Crochets, V Comme Rocher Sur La Canette
J'Ai Des Projets Pour La Planète, J'Vais T'Embrocher Sur Ma Baguette
J'Taffe Comme Chinois Pour M'Rapprocher De La Stargate
J'Donne Le Hoquet Lorsque J'Allaite, Je Suis Opé, Tu Es Charrette
Quand Tu Commences, On T'Dit : ""Arrête""
D'Vant Une Barette, J'Ai Plus D'Force, D'Vant La Malette, J'Veux Plus D'Or
Laisse-Moi Tranquille Merkus Mord, Cherche Pas D'Problèmes, C'Est Juste Mort
V.A.L.D. Jedusor, Quand Tu Parles, Tu T'Fais Du Tort
Dans Ton Corps, On Fait Du Sport, Tu Fermes Ta Gueule Et Tu Sors
Dans Les Airs, Que Des Spores, Fers En L'Air De L'Escorte
Dans Les Airs, Verre En L'Air, On S'Efforce En Pleine Forme
Trophée, Trophée, J'En Ai Trop Fait
Certains Sont V'Nu Pour Une Durée Provisoire, Pour S'Faire Baiser Dans L'Fumoir
Leurs Éthiques Sont Trop Bizarres, T'Es Pas Très Sûr, J'Suis Official
J'Peux Te Shlasser Au Visage Pour Mettre Sourire Sur Ton Minoi
Je Travaille Ceinture D'Explosifs, Pas Ceinture Abdominale
Je Cherche À Être Pas À Avoir, Ta Mère Et Ta Grand-Mère À La Fois
Mes Lyrics Ne Sont Pas Rasoirs Par Hasard
Vicieux Comme Salazar Dans Resident Evil
Mathafack, J'Prends D'L'Assurance Comme Calvitie D'Résident Sénile
Trophée

[Couplet 16]
J'Veux Pas Faire Partie D'La Jetset, J'Coupe Ma Sobies' Au Get 27 À La Limite
Mais C'Est Cadavérique, Cette Ambiance De Pète Sec, J'Suis Comme, J'Suis Comme Paralysé
Le Sperme S'Consomme Comme Chewing-Gum Et De P'Tites Drogues Pour Faire Rire L'Homme
Transitent De Mains En Mains, Plus J'Côtoie L'Homme, Plus Je L'Aime De Moins En Moins
Et Plus On Parle, Et Puis Plus Ça Glisse En Partouze
Qu'Est C'Que Tu Veux Faire Quand T'As V'Là L'Flouze ? On S'Ennuie Partout
Gros, C'Est Pas L'Tout Qu'T'Aies Les Cartouches Ou Les Cartes, Faut Qu'T'Écrases Tout Ou Qu'Tu Les Écartes
J'Vois Ma Vie Comme Un Cartoon, Mes Ennemis M'Attrapent Jamais, J'Mange Des Bonbons À La Pelle
Lorsqu'On Veut M'Aider, On M'Tend La Main D'Jamel, Pédé, Passe La Zeb, J'Suis Pas La Bête De Foire De Captcha Mag'
Et Le Monde Est Tellement Grand, J'Rassemble Les Éléments
J'Ai L'Idée, J'Ai Les Vœux, Cette Bitch Est Vénéneuse
Je Lean, Et J'Fais Des Euros, On Fait Vibrer Tes Vieux Os
Ma Firme Est Généreuse
Pas D'Fausse Modestie, J'Manie L'Crom Et L'Bic Comme Joe Pesci
T'Obéis Aux Mauvais Types, On Cautérise Nos Plaies, On Joue La Comédie
On Monétise Nos Vies, Violètise Nos Vues
Nos Limites, Vos Limites, Grosse Équipe, Bose Et Pique
Do, Ré, Mi, Faut Rer-Ti, Les Questions ?
Pute, J'Ai Besoin D'Horizon, Mais Ton Gros Cul Cache La Vue, J'Suis Noyé Dans L'Houblon, Le Réel Ne M'Atteint Plus
J'Suis Dans L'Truc Et Dans L'Tur Comme Dans Balladur, Pose Ta Tête Sur Mon Armature
Ça Rassure, J'Fais Tout Pour Me Rassasier, Si Tu Doutes, Tu Feras L'Reste À Pieds
Allez, Bouge, Laisse Taffer Les Grands, Y'A D'La Mouille Sur L'Estafette, Étrange
Intense Étranglement Quand J'Reviens Dans La Matrice, Quand J'Sors Mon Micro, Y'A Toujours Une Amatrice
Fils, Roule Pas Tes Splifs Avec Un Amas D'Terre, Je Plie Ces Amateurs, Les Yeux Plissés Vers Quatre Heures
Je Vois Les Âmes À Terre, Leur Tête Inclinée, Lezarman Fait Sa Ronde
Quand J'Te Prends Par Derrière, Je Vois Cligner L'Œil De Sauron
Tout Niquer, Chez Nous, C'Est Inné, Que Tu L'Veuilles Ou Non

[Couplet 17]
T'Es Qu'Un Branleur, Tu Penses Qu'À T'Toucher La Bite
Tu Sèches Les Cours Pour Aller T'Acheter Des Cartes À Jouer Magic
T'Es Même Pas Bon Dragueur, Tu T'Frottes Sur Des Pneumatiques
Toujours Fatigué Parce Que Tu T'Tapes Des Queues La Nuit
Puis Par Principe, Tu T'Réveilles Mais T'Es Tout L'Temps Avachi
Souvent De Sept À Sept, Tu Bailles Parce Que ""La Vie C'Est Pas Facile""
T'Attends Qu'La Rime T'Aère L'Esprit, T'Espères Ve-Squi L'Salaire D'Usine
Mais T'Es Qu'Une Carcasse : Des Magazines De Sapins Dans Ton Cartable
Insupportable, T'Sais Qu'T'Emmerdes Les Gens Avec Ton Sarcasme ?
Que J'Te R'Chope Devant Des Discours De Soral Et J'T'Envoie Pascal
C'Est Tout L'Temps La Même Chose : Tu Fais Rien Mais Tu T'Reposes
T'Abandonnes Chacun D'Tes Jets-Pro, T'Attends Patiemment La Nécrose
Arrête Les Bédos, Les Restos, Kebab, Les Mots Sur Les Dos D'Pétasses
Tu Fais La Déco, Dégage, T'Es Bien Dans L'Métro, Mec
Jour Après Jour, T'Es De Plus En Plus Mou
T'As L'Impression D'Être Inutile Et Encore Plus Quand Tu Joues
Du Coup, Pas D’Échappatoire, T'Es Comme Une Larve À L’Abattoir
De La De-Mer Dans La Mâchoire, Déclare Ta Flamme À Ta Main Droite
Décale, J'Te F'Rai Pas D'Cadeau Si J'Te Rechope À Bédave
Fais L'Malin Qui Veut Pé-Ra, J'Te Nique Ta Race Devant Tes Gars
D'Ailleurs, D'Ailleurs Tes Gars Sont Rants-Ma, Sont Encore Plus Atteints Qu'Toi, Sans Blague
J'Me D'Mande Qu'Est Ce Qu'Ils Peuvent Bien T'Trouver, T'Es Bon Qu'À Faire Les Cent Pas
Mais Quand Vas-Tu Prendre Ta Vie En Main ? Rendre Ta Mère Ravie
T'Mettre À Taffer Au Lieu D'Tenter D'Ressusciter Yitzhak Rabin

[Couplet 18]
Je Joue Pas Les Rappeurs, J'Suis Vraiment Un Rappeur, J'Ai Vraiment Des Diamants, J'Ai Vraiment Des Haters
J'Suis Vraiment Le Amant Préféré De Ta Sœur, J'Ai Vraiment Le Million
Depuis, J'Suis Vraiment Plus Mignon, Je Tire Sur Le Pilon, J'Incite Tous Les P'Tits Cons À Faire Comme Moi
À Me Suivre Comme Suikon ; Spielberg Appuie Sur Les Pédales, J'Suis E.T. Chinois Sur Le Guidon
Viens Égarer Ton Hymen À La Maison, Je Sais Qu'J'Ai Tort De Boire Plus Que De Raison
Red Bull Effet N'Donne Des Ailes, Vas-Y, Moi Aussi, J'Vais Louer La Tour Eiffel
J'Crie ""V. A. L."" Partout Comme Si J''Tais Dz, Elle En Fout Partout Comme Si C'Était Chez Elle
Ça Sent La Mer Et On Dort Sur Des Serviettes, J'Fais La Belle Étoile, Le Décor Est Parfait
Le Savoir Est Une Arme, Apprends Tes Leçons, Devant Le Canon, Mouille Ton Caleçon
Ce Monde Est Cruel Comme Cet Hameçon, D'Laquelle T'Es Amoureux, Pauvre Garçon ? (Pauvre Garçon)
Me Kidnappez Pas, J'Fais Grimper La Rançon
On Peut Doubler À Chaque Fin De Saison, J'Suis Adoubé Même Après L'Horizon
Imprévisible, Sans Clignotant, Ma Trompe Partout, J'Suis Papillonnant, Faire De L'Argent, C'Est Passionnant
J'Peux Sortir D'Aulnay, Je Peux Sillonner
Tous Mes Copains, J'Vais Les Pistonner, Même S'Ils Sont Nuls, J'Vais Les Imposer
D'T'Façons, Tout Est Déjà Imposable, Même, Des Fois, L'Trafic De Pistolets
Je Graille Tout L'Monde, J’Ai Encore La Dalle, Dors Sur La Béquille, Je Dors Sur La Cale
J'Sais Même Pas Pourquoi Je Bédave À Balle, Ça M'Rend Parano, J'Me Crois En Cavale
Garde Ton Venin, J'Préfère Quand T'As Mal, Pourquoi Ça Te Fait Plus De Bien Quand T’As Mal ?
Pourquoi Tu Fais Genre C’Est Ta Première Anale ? Pourquoi Tu Fais Genre Tu Connaissais Pas Vald ?
Ar Discrets Entre Frontière Et Paname, L'Ar Fifteen A Du Recul Mais Ça Va
Tu M'Vois Tranquille Et Tout Mais, En Vrai, J'Ai La Rage, ""Euros, Euros, Euros"" : C'Est Quoi Cet Adage ?
Ton Jet-Pro D'Merde, C'Est Du Rap Ou Du Tapage ? Tu Fais D'La Merde Comme Ta S'Maine De Démarrage
Garde Ton Honneur, Arrête De Faire Étalage, Fais Des Donuts Avec La Fumée Du Kamas
V-A-L-D, Le Décès Pour Dérapage, V-A-L-D, Le Décès Pour Décalage
J'Vis En Fps Comme Avec Un Kalach' Et En Pov Comme Avec Un Famas
J'Suis Trop Déprimé, Je Vide La Pharma', C'Est Toujours Les Mêmes Fils De Putains Qui Ramassent
Le Savoir Se Perd Car Tout L'Monde Parle Trop, J'Ai Ouvert Moins De Bouquins Que De Balle-Trous1Embed"
